"";"URL";"Info";"Direccion";"Precio";"Superficie";"Habitaciones";"Planta";"Longitud";"Latitud"
"1";"https://www.idealista.com/inmueble/1751617/";" ""2ª planta en bloque de 4 plantas con bajo y con vistas a la Azucarera. Urbanización en Pza. Mozart con zona comunitaria. Zona muy bien comunicada. Con gran cantidad de servicios. A 15 min. de la plaza de EL PILAR. Piso silencioso y luminososo. Baño y cocina reformados. Puertas nuevas de haya y ventanas climalit. Amplia despensa. Galería en la cocina. Al no tener pasillo y tener armarios empotrados, las habitaciones son amplias. Calefacción central de gas con radiadores de hierro fundido y se paga por las horas que la tienes encendida, supone un mayor ahorro. Bombillas led en toda la comunidad y calderas nuevas de gas por resultar más económico a largo plazo (inversión ya pagada). Garaje de 10 m2 y trastero de 8,43m2 con acceso desde el ascensor. Distribución: 2 vecinos en cada planta.Portero automático con pantalla. Zonas comunes para pasear y poder estar con niños(acceso a minusválidos). Nos cambiamos porque necesitamos una habitación más."" ";"Piso en venta en calle Marques de la Cadena, 61, Arrabal, Zaragoza";"136000";"69";"2";"1ª";"-0.867641";"41.6645447"
"2";"https://www.idealista.com/inmueble/31241318/";" ""REF. MCC1271TAPlanta baja en Cubelles a unos 700 metros de la playa.DISTRIBUCIÓN: (210 m2 construidos)- 4 habitaciones- 2 baños completos y 1 aseo de cortesia- Patio individual de 140m2 con barbacoa y jardin- Cocina totalmente equipada con patio interior- Despensa- Trastero doble- Plaza de garajeCALIDADES:- Ventanas climalit- Puertas de haya- Toda acondicionada para minusválidosZONA Y TRANSPORTE PÚBLICO:Zona muy tranquila, cerca de todos los servicios y playa, rodeada de naturaleza, tranquilidad, impresionantes vistas e impagables puestas de sol. Sin duda en ella usted ganará en calidad de vida. Estará a tan sólo a 5 minutos tanto del tren (RENFE) como de la parada de autobús. Ambos transportes tienen parada en el popular municipio costero de Sitges, Barcelona y aeropuerto."" ";"Piso en venta en Santa Maria-Eixample-Sud Sumella, Cubelles";"190850";"210";"4";"Bajo";"1.6773835";"41.2114176"
"3";"https://www.idealista.com/inmueble/34238788/";" ""Piso en el centro de Alagón. El piso consta de 75 m2 en planta. Este piso cuenta con 3 amplios dormitorios, dormitorio principal de 13 m2, 1 baño completo, cocina, hall de entrada y un amplio salón (25 m2) con balcón a exteriores. Vistas a exterior y a terrazas interiores de la urbanización, muy luminoso durante todo el día, el patio interior de la urbanización es amplio y abierto. Excelente ventilación. Calefacción individual a gas. Se entrega recién pintado, limpio y amueblado, tal y como se ve en las fotos (incluye muebles y electrodomésticos ) ideal para entrar a vivir. Suelo de gres. Muebles madera de haya. Orientación SurLa instalación de lavavajillas está hecha. Parking y trastero en edificio incluidos en precio. Plaza de 12 m2 (plaza coche grande)-Trastero de 7, 20 m2Para visitarlo o más información llame al (abstenerse agencias y alquileres). NEGOCIABLES."" ";"Piso en venta en calle baltasar gracián, 1, Alagon";"80000";"80";"3";"2ª";"-1.1207968";"41.7712972"
"4";"https://www.idealista.com/inmueble/30033965/";" ""Cueva Bios Bodega 79.000 euros *** AHORA reducido en más de 65.000 EUROS EN TOTAL Y UNA VENTA RÁPIDA SE REQUIERE ***Una propiedad sustancial, casa cueva parte, casa de parte de la ciudad a poca distancia del centro de Cuevas del Campo.Esta propiedad está siendo utilizado como una casa, pero podría ser fácilmente dividida en tres alojamientos independientes, cada uno con 3 o 4 dormitorios. Actualmente hay 21 habitaciones, 2 terrazas y un gran patio.Algunos modernización ya ha tenido lugar, pero se necesita más trabajo en todo. Todos los servicios de red están conectados y los compradores sin duda podrían entrar y terminar el resto de la obra a medida que avanzan.Esta propiedad sería una cama y desayuno fantástico con un alojamiento del propietario, o, posiblemente, podría ser completado como una gran casa familiar, o 3 edificios independientes con posibilidades de alquiler.Cuevas del Campo es una pequeña ciudad comercial, cerca de las playas del hermoso Lago Negratín, y rodeado de no menos de 4 Parques Naturales: Sierra Nevada, Sierra de Baza, Sierra de Castril y Sierra de Cazorla.Hay un montón de cosas que hacer en la Pesca zona-, Quad-Ciclismo, Ciclismo de Montaña, Senderismo, Equitación, Vela, ala delta, Ciclismo, Photographic Tours, Excursiones a pie, observación de aves, pintura de acuarela o incluso contemplar las estrellas .Hay muchos restaurantes y bares de la zona, y que no han vivido hasta que haya visto una de las muchas fiestas que hacen de la zona tan popular!"" ";" Casa o chalet independiente en venta en calle Violin, 24, Cuevas del Campo";"79000";"350";"21";"Hipoteca 202 eur/mes - ";"-2.9249325";"37.6081913"
"5";"https://www.idealista.com/inmueble/32288073/";" ""Se vende, sin comisión al comprador, vivienda de 74 metros cuadrados, de un dorimitorio, en residencial en Altorreal, con 3 piscinas, en un entorno tranquilo y seguro. La vivienda dispone de garaje y trastero. Salón-comedor, cocina, vestíbulo, dormitorio con gran armario empotrado forrado y vestido en madera de haya. Cristales dobles, carpintería de aluminio termolacado en ventanas, aire acondicionado por conductos, Antigüedad, año 2.007. Estado de conservación muy bueno. Precio rebajado. Posibilidad de venta con equipamiento si así se desea, en muy buenas condiciones, así como de subrogación a hipoteca en condiciones muy favorables. Para más información: Referencia 180 Murcia Residencial Inmobiliaria – Altorreal.com"" ";"Piso en venta en calle castillo de ricote, Altorreal";"85000";"74";"1";"2ª";"-1.1805651";"38.0725787"
"6";"https://www.idealista.com/inmueble/31943651/";" ""Excelente vivienda totalmente reformada incluso fontanería y sistema eléctrico en la zona de los colegios en Santa Pola, consta de 3 dormitorios con armarios empotrados, 2 cuartos de baño, amplio salón comedor, 2 patios pisables, amplia cocina independiente y equipada, aire acondicionado central frío y calor, suelo de cerámica, puertas de paso de madera de haya, ventanas en aluminio de climalit, cerca de los comercios en general en Santa Pola.Esta maravillosa vivienda está ubicada en Santa Pola pequeña zona turística a las orillas del Mediterráneo. Conocida a nivel nacional por sus inmejorables playas kilométricas y voluminosas dunas de arena fina. Santa Pola está muy bien conectada, a tan solo 20 minutos conduciendo de Alicante capital y a tan solo minutos del Aeropuerto de Alicante. Nuestra oficina se encargará de ajustarse lo máximo posible en la búsqueda de las viviendas apropiadas y así poder garantizar el porvenir de nuestros clientes,Brindando nuestros años de experiencia para poder ejecutar las operaciones necesarias, tanto en ventas como en alquileres de manera seria y responsable ya que nuestro objetivo principal la gestión y promoción inmobiliaria.Puede confiar en nosotros, para que seamos los responsables de la búsqueda del inmueble adecuado para usted o para que trabajemos con su vivienda, nosotros responderemos De la mejor manera posible.Gestión Mediterránea.Para más información póngase en contacto con nosotros vía telefónica o por e-mail."" ";"Piso en venta en Centro, Santa Pola";"84000";"125";"3";"Bajo";"-0.5537289";"38.1972171"
"7";"https://www.idealista.com/inmueble/26371743/";" ""Obra Nueva piso de 2 dormitorios en Juslivol, barrio de Zaragoza con parada de autobus de tuzsa línea 43 ( Coso - Juslivol ) a pocos metros del portal. Este piso está distribuído en salón- cocina americana de casi 25m2, 2 dormitorios y baño con plato de ducha y terraza de 8 m2. La vivienda tiene pavimentos parquet flotante en roble y gres ceramico en cocina, baño y aseo, gres ceramico para exteriores en las terrazas, alicatados en cocina, baño y aseo de azulejos ceramicos con cenefas. La carpintería interior en haya, con puerta de entrada blindada y vidrieras en la puerta de cocina y salón. La carpinetría exterior en aluminio lacado con persiana de aluminio y acristalamiento climalit. La cocina va equipada con mobiliario alto y bajo, fregadero, encimera de granito, placa vitroceramica, horno, campana, frigorífico, lavadora y lavavajillas. Tiene calefacción y aire acondicionado por bomba de calor. El agua caliente es individual por placas solares. El edificio dispone de ascensor, portero automatico, garaje y trastero. Es una 2º planta de 3 alturas. Al precio hay que añadir el 10 % de IVA."" ";"Piso en venta en calle Pilar Figueras, Barrios rurales del norte, Zaragoza";"114000";"57";"2";"2ª";"-0.8967125";"41.6944643"
"8";"https://www.idealista.com/inmueble/27043962/";" ""preciosa vivienda completamente reformada de unos 70m2 distribuida en salón de 22,5 m2, 3 dormitorios con armarios hechos a medida, cocina reformada amueblada y equipada con todos los electrodomesticos y baño reformado con plato de ducha. Tiene puerta blindada, suelos de tarima flotante y gres ceramico en cocina y baño, puertas de haya, ventanas de aluminio con cristal climalit, luces halógenas en el hall, pasillo, cocina y baño, calefacción central con contador individual y agua caliente central con contador individual. Se vende amueblado o sin amueblar. Tiene unos 50 € de gastos de comunidad. Es un piso muy alegre soleado y luminoso. En perfecto estado para entrar a vivir."" ";"Piso en venta en calle Mayor, Miralbueno - Bombarda, Zaragoza";"1e+05";"70";"3";"4ª";"-0.9437894";"41.6571242"
"9";"https://www.idealista.com/inmueble/31714441/";" ""La vivienda es un 2º piso (pero podemos ofrecer otra altura y otra orientación), está nueva; con suelo de tarima flotante aire acondicionado y calefacción en toda la vivienda; carpintería interior de madera de haya; puerta acorazada; GARAJE Y TRASTERO; armarios empotrados forrados de madera; grifos en el baño(con ventana exterior), del dormitorio, con regulación de temperatura (bañera); el otro baño es con pié de ducha. A POCOS METROS DE LA PARADA DEL TRANVÍA. AMPLIAS VISTAS A JARDINES. Todo exterior. Cristales dobles Climalit."" ";"Piso en venta en avenida juán de borbón, Zona Juan de Borbón, Murcia";"138000";"110";"3";"2ª";"-1.1290917";"38.0065184"
"10";"https://www.idealista.com/inmueble/32230313/";" ""Oportunity vende piso en Avinguda Barberà, consta de 92m², distribuidos en 4 habitaciones de las cuales 2 son dobles, 1 baño completo con plato de ducha, 1 aseo, cocina office independiente con salida a lavadero, amplio comedor de 25m² con salida a un balcón, vivienda dotada de calefacción, suelos de parket, ventanas de aluminio climalit, carpintería interior de haya y finca con ascensor. Orientación sur. Completamente reformado de diseño para entrar a vivir y muy bien comunicado cerca de transporte público, colegios y comercios."" ";"Piso en venta en avenida de barberá, 304, Eixample, Sabadell";"157000";"92";"4";"2ª";"2.1155023";"41.5330003"
"11";"https://www.idealista.com/inmueble/28234276/";" ""Superf. 190 m², útil 160 m², 5 habitaciones (3 dobles, 2 individuales), 2 baños, cocina (amueblado), lavadero, comedor, terraza, suelos gres, muebles, puerta blindada, portero automático, año construcción 2003, carpintería exterior aluminio doble acristalamiento, carpintería interior haya, aire acondicionado, exterior, orientación sureste, soleado, Estado certificación vivienda con muchas mejoras, escayola en cocina y entrada, halógenos, dispone de vestidor en principal, garaje con altillo, cocina de 20 m2, comedor muy amplio, porche enlosado. Muy buena situación, zona muy tranquila. ITP, notaría y registro no incluidos."" ";"Dúplex en venta en Huércal de Almería";"186000";"190";"5";"Bajo";"-2.4456838";"36.8706326"
"12";"https://www.idealista.com/inmueble/27533990/";" ""piso de obra nueva, en el barrio de magraners. con una superfície construida de 62.06m2y útil de 58.38m2. consta de 1 habitación doble y 1 de individual. Baño con bañera. Cocina independiente totalmente equipada con horno, vitroceramica, campana extractora, preinstalación de lavavajillas. lavadero con preinstalación de lavadora. amplio comedor con salida a la terraza. todas las habitaciones son exteriores con salida a la terraza. terraza de 8m2. cerramientos exteriores de aluminio con rotura de puente térmico, doble cristal y persianas de aluminio. los suelos son de gres. carpinteria de haya. calefacción colectiva de biomasa. certificación energetica a. piso muy soleado. en el precio va incluido el parking y el trastero. vivienda vpo"" ";"Piso en venta en calle Antoni Guix i Ribelles, 4, Magraners, Lleida";"69900";"62";"2";"1ª";"0.6630522";"41.6125854"
"13";"https://www.idealista.com/inmueble/29274203/";" ""Superficie vivienda 83 m2. 4º planta Exterior. Totalmente reformado, muy actual. Distribuido en: Salón 18 m2. con acceso a Terraza 10 m2. , Cocina totalmente equipada zona Barra Silestone y columna de Hornos con encimera vitrocerámica y galería. 3 Dormitorios dobles, 1 baño 3 Piezas con Ducha amplia y mampara Mueble Bajo-pica Wengué diseño Actual. Muy acogedor y buena distribución. Listo para entrar a vivir. Zona: Cerca de todos los comercios Doctor Reig, Farmacia y Bus. Calidades: Suelo Parquet, Carpintería exterior Aluminio, Carpintería interior Haya, Calefacción por módulos. CON TERRAZA. ¿CUANDO QUIERE VERLO?."" ";"Piso en venta en Barri Antic - Centre, Viladecans";"167000";"95";"3";"4ª";"2.01582";"41.31768"
"14";"https://www.idealista.com/inmueble/25447205/";" ""Superf. 530 m², 2000 m² solar, 5 habitaciones (5 dobles), 6 baños, alumbrado, asfaltado, urbanizado, cocina (office), lavadero, comedor (2), terraza (200 m2), suelos mármol, jardín, garaje, armarios, calefacción, muebles, puerta blindada, vidrios dobles, agua, luz, gas, chimenea, carpintería exterior climalit, carpintería interior haya, aire acondicionado, orientación mar, vistas, soleado, piscina, alarma, teléfono. Ciudad cosmopolita de más de 60. 000 habitantes, entre Barcelona y Sitges, la villa de Castelldefels se encuentra en un lugar privilegiado de la costa mediterránea, para disfrutar de lo mejor de Barcelona por su proximidad y al tiempo que reside en una zona tranquila y relajada de playa ó montaña, pero con alternativas de ocio. Prestigiosas escuelas internacionales como el British School of Barcelona y Lycée Français Bon Soleil ó Clubs Internacionales de tenis de alto rendimiento y porque no, poder amarrar su barco en el puerto deportivo Port Ginesta. Disfrutar de la mejor gastronomía española e internacional en sus más de 60 restaurantes que dispone la zona, teatro, cines, centros comerciales etc. Comunicación por autopista ó autovía, trenes y autobuses comunican la ciudad con cualquier destino."" ";" Casa o chalet independiente en venta en El Poal, Castelldefels";"2575000";"530";"5";"Hipoteca 6.601 eur/mes - ";"1.9455837";"41.2715952"
"15";"https://www.idealista.com/inmueble/30548489/";" ""Bonito apartamento seminuevo obra de nueve años de antiguedad en la calle escultor ramirez ideal para parejas jovenes. 40m, 1 dormitorio, salon, cocina y baño. Terraza de 5m con un armario. Cocina totalmente equipada con lavadora, lavavajillas etc. Calefacción individual gastos de comunidad 47 euros. Puerta blindada, suelos de parquet, ventanas de aluminio en gris oscilobatientes climalit, puertas de haya, estucado muy finito. Aire acondicionado por conductos en toda la vivienda. Videoportero. Ascensor. Exterior. Garaje y trastero de 5m. Comisión incluida y precio negociable."" ";"Piso en venta en Escultor Ramirez, San José Alto, Zaragoza";"90000";"50";"1";"1ª";"-0.8731161";"41.6317079"
"16";"https://www.idealista.com/inmueble/30838596/";" ""Impecable casa de 250 m2 construida en parcela de 475 m2 dividida en sótano, planta baja, primera planta y estudio. La planta baja: consta de un amplio salón -comedor 30 m2 con salida a jardín 230 m2 con barbacoa y árboles frutales con piscina de 6m x 3m, cocina equipada de 20 m2 muy luminosa con salida a porche, un dormitorio doble suitte con baño de cortesía + dormitorio especial para plancha y salón-comedor 20 m2 con chimenea con salida a porche. Dispone de garaje grande de 30 m2 con capacidad para varios coches. En primera planta: tres dormitorios dobles dos de ellos con armarios empotrados, baño completo con bañera y un estudio de 50 m2 con salida a terraza 12 m2. Sótano de 90 m2 con zona de lavado + aseo. dispone de calefacc. , a/ a. , alarmas y cámaras de seguridad. Puertas de haya, persianas eléctricas y aljibe de recogida de aguas flubiales de 12m x 2´50 m. Situada en muy buena zona y muy bien comunicada. Lista para entrar a vivir."" ";" Casa o chalet independiente en venta en Mas Ram, Badalona";"635000";"260";"5";"Hipoteca 1.627 eur/mes - ";"2.2564139";"41.475411"
"17";"https://www.idealista.com/inmueble/30878701/";" ""Superficie 90 m² útiles, 3 habitaciones, 1 baño, cocina amueblada c/e, terraza lavadero con cierre, salón (24 m² aprox. ), suelos terrazo, ascensor, 1 armario empotrado y vestido, puerta blindada, año construcción 2003, gastos comunidad 40 €/mes, agua termo eléctrico, carpintería exterior aluminio blanco con mosquiteras enrollables, carpintería interior haya de diseño, aire acondicionado (1 split f/c), exterior, balcón, luminoso, con mejoras, certificación energética en trámite."" ";"Piso en venta en San Roque - Ronda norte, Badajoz";"99000";"90";"3";"2ª";"-6.9532914";"38.8794884"
"18";"https://www.idealista.com/inmueble/30930096/";" ""VENTA PRECIOSA PLANTA BAJA EN CALA VINYES A 100MTS DE LA PLAYA! NO DUDE EN VISITARLA!. Se vende planta baja en perfecto estado construida en el año 1994. A 100 m. de la playa de Cala Vinyas. La vivienda dispone de 110 m2 distribuidos en 3 dormitorios (dos de ellos dobles y uno individual), 2 baños (uno en suite), recibidor, salón-comedor de 25 m2, cocina con pasa platos amueblada y equipada, coladuría, sala de estar de 10 m2. También dispone de una terraza de 80 m2 más 30 m2 de terraza cerrada acristalada. Jardín comunitario, parking exterior y porche. La carpintería interior es de madera haya y la exterior de aluminio. Calefacción por conductos. Aire acondicionado frío/calor."" ";"Piso en venta en Cala Vinyes, Calvià";"275000";"110";"3";"Bajo";"2.5301598";"39.4954481"
"19";"https://www.idealista.com/inmueble/30943230/";" ""Impresionante vivienda adosada de alta calidad con 155m² construidos en un residencial cerrado, con una orientación y ubicación perfectas, buenas comunicaciones, a tan solo 6 km de Sevilla capital y rodeados de todo tipo de servicios como farmacias, colegios, a 8 minutos a pie del metro o a 3 de supermercados y el centro comercial. Porche delantero y trasero, terraza en buhardilla de 30m², aparcamiento privado con puerta automática, climatización centraliza por planta mas split en buhardilla, cocina amueblada con electrodomésticos, puertas interiores de madera en haya, carpintería de aluminio lacado en blanco con climalit y rejas, suelos de mármol gris, armarios empotrados e instalación de gas ciudad. Zonas comunes interiores con jardines, pista de paddel, piscina infantil acotada y de adultos.Al entrar encontramos el patio delantero donde se ubica el aparcamiento, además de espacio de sobra para disfrutar de esta zona, una vez dentro de la vivienda tenemos un amplio recibidor que cuenta con un armario empotrado de desahogo, a la izquierda el baño de planta baja equipado con placa de ducha, a la derecha el luminoso salón con una puerta corredera que da paso al comedor independiente, al fondo del recibidor la cocina totalmente amueblada, con despensa y salida al patio trasero de 30m², desde aquí accedemos a las zonas comunes como jardines, piscinas, pista de paddel, etc... Subimos a planta primera donde se sitúan los dos amplios dormitorios simples con sus armarios empotrados, el baño que da servio a esta planta equipado con bañera y el dormitorio principal que cuenta con un vestidor a la entrada, el baño en suite con placa de ducha y una terraza privada, continuamos subiendo y llegamos a la planta alta que cuenta con una terraza de 30m² y la habitación buhardilla también con su armario empotrado y climatización por split individual.Una vivienda de gran calidad, buenos servicios y excelente comunicación.(Honorarios de inmobiliaria incluidos en el precio publicado. Gastos propios de la compraventa, como notaría, registro e impuestos, NO incluidos. Documento informativo abreviado a disposición del consumidor Dto. 218/2005 de Junta Andalucía.)"" ";" Chalet adosado en venta en Hacienda la Cartuja, Tomares";"280000";"155";"4";"Hipoteca 717 eur/mes - ";"-6.0434656";"37.3627341"
"20";"https://www.idealista.com/inmueble/645200/";" ""Superficie 45 m² útiles, 1 habitación doble, 1 baño, cocina americana amueblada c/e, comedor, terraza de 30 m², trastero, suelos terrazo, plaza de garaje (amplia y fácil), ascensor, armarios, calefacción y agua caliente por gas natural, se vende amueblado, puerta blindada, vidrios dobles (climalit), año construcción 2008, gastos comunidad 28,50 €/mes, carpintería exterior aluminio blanco, carpintería interior haya, aire acondicionado, exterior, muy luminoso. Estado certificación: En trámite."" ";"Ático en venta en San Roque - Ronda norte, Badajoz";"109000";"45";"1";"2ª";"-6.6758906";"38.9747741"
"21";"https://www.idealista.com/inmueble/794553/";" ""Superficie 60 m² útiles, 2 habitaciones, 1 baño, cocina amueblada c/e, salón, trastero (15 m²), suelos tarima, 2 armarios empotrados y vestidos, puerta blindada, vidrios dobles (climalit), año construcción 1981, gastos comunidad 20 €/mes agua incluida, agua caliente por termo eléctrico, carpintería exterior aluminio blanco, carpintería interior haya, aire acondicionado, calefacción por calos azul, exterior, luminoso, totalmente reformado, se vende amueblado."" ";"Piso en venta en San Roque - Ronda norte, Badajoz";"81000";"60";"2";"3ª";"-6.959629";"38.880124"
"22";"https://www.idealista.com/inmueble/1065500/";" ""Superf. 175 m², útil 175 m², 4 habitaciones (2 dobles, 2 individuales), 2 baños, alumbrado, asfaltado, cocina (amueblada 12 m2), lavadero, comedor (36 m2), terraza, suelos tarima y gres, armarios, muebles, puerta blindada, año construcción 1981, carpintería exterior aluminio, carpintería interior haya, aire acondicionado, orientación este-oeste, soleado, Vivienda en una sóla planta, dispone de terrado, accesible con toda la extensión de la vivienda, reformada de todo hace 7 años, despensero, recien pintada, mirador muy luminoso. Inst, de luz y agua nuevas. Impuestos, notaría y registro, no incluidos.."" ";" Casa o chalet independiente en venta en Centro, Almería";"211120";"175";"4";"Hipoteca 541 eur/mes - ";"-2.4686044";"36.8378365"
"23";"https://www.idealista.com/inmueble/32384181/";" ""Bajo vivienda en un edificio completamente rehabilitado en el 2006 y a la vivienda se accede a través del zaguan del edificio. La puerta de entrada es blindada.Tiene 60 m2 (cocina-salón con ventanal tipo espía a la calle; baño completo con claraboya y buhardilla con habitación con ventana a patio de luces del edificio).Los techo son altos, con bóvedas y vigas de madera, paredes de caravista recuperado y lisas en color, suelo cerámico, ventanas con rejas, persiana y climalit, aire acondicionado con bomba de calor, cocina con muebles altos y bajos en haya, con bancada y frente de silestone y campana decorativa.El baño tiene las paredes de caravista, una claraboya en el techo para tener luz y ventilación directa, ducha de obra con mampara.El suelo de la buhardilla es de madera pintada en blanco envejecido, al igual que la escalera y tiene una parte de cristal, con luces led al igual que el cristal del lateral.La calle es muy tranquila y la zona dispone de todos los servicios."" ";"Piso en venta en calle padre rico, La Petxina, València";"105000";"60";"1";"Bajo";"-0.3910367";"39.4703506"
"24";"https://www.idealista.com/inmueble/32282404/";" ""Piso ideal en finca nueva, 80 metros, 2 habitaciones + 2 baños, exterior, luminoso, ventanales de climalit, preinstalacion de aire acondicionado y calefaccion por conductos, suelo de terrazo, puertas de haya, garaje incluido en el precio, totalmente exterior a dos calles, zona nueva de Mislata, al lado del parque de Cabecera, ambulatorio, polideportivo, Consum. Llama ya al seis cuatro nueve, ocho siete, ocho nueve, cuatro uno y no lo dejes escapar!."" ";"Piso en venta en La Constitución - Canaleta, Mislata";"133000";"85";"2";"1ª";"-0.4138966";"39.4793529"
"25";"https://www.idealista.com/inmueble/32029617/";" ""Fantástico piso tipo casa, con entrada independiente. Se trata de un primero de 107m2 construidos, distribuido en 3 amplias habitaciones, 1 de ellas divisible en 2 habitaciones. Gran cuarto de baño completo y reformado con plato de ducha realizado en obra. Amplio comedor con salida a balcón, junto al que encontramos una gran cocina office reformada y con ventana al exterior y con un amplio lavadero que da acceso a una gran terraza de unos 85m2 muy soleada, que ocupa prácticamente todo lo que es la vivienda. Además dispone de un gran trastero, ideal para despensa. Toda la carpintería interior es de roble, la exterior de aluminio y contamos con calefacción en todas las dependencias.La zona se haya comunicada con el centro de Sabadell por vías principales de acceso o bien a través de la línea 4 de autobús. Además de contar con colegio, centro cívico y diferentes comercios de uso diario."" ";"Piso en venta en collell, 9, Torre-Romeu - Poble Nou, Sabadell";"93000";"107";"3";"1ª";"2.1271256";"41.5611149"
