"";"URL";"Info";"Direccion";"Precio";"Superficie";"Habitaciones";"Planta";"Longitud";"Latitud"
"1";"https://www.idealista.com/inmueble/30520646/";" ""Casa rústica con mucho encanto reformada y convertida en una vivienda moderna y confortable. Tiene 180 metros repartidos en 3 plantas de 60 metros cada una, la última abuhardillada. Las habitaciones son muy luminosas y coloridas. Salón con chimenea. Dos baños completos y un aseo. Armarios empotrados en todas las habitaciones. Radiadores cerámicos, caldera eléctrica. Cocina amueblada con todos los electrodomésticos. Dispone de jardín con zona de barbacoa y una parcela con árboles de 518 metros (urbanizable si en el futuro se quiere construir otra vivienda). La casa tiene unas vistas preciosas al arrollo y al valle de Bustriguado, se haya rodeada de naturaleza, a 4 km de la sierra del Escudo y a 15 minutos en coche de algunas de las playas más bonitas de Cantabria, como la del Parque natural de Oyambre, San Vicente de la Barquera o Comillas. Está a 30 minutos en coche del aeropuerto y del centro de Santander, y a 15 minutos en coche de la estación de tren de Torrelavega. La casa cuenta, además, con un cobertizo independiente y perfectamente aislado de 25 metros cuadrados ideal para taller, guardar las bicicletas, la leña, etc."" ";" Casa rural en venta en Barrio la Cocina, 11, Valdaliga";"2e+05";"200";"4";"Hipoteca 512 eur/mes - ";"-4.3515749";"43.319637"
"2";"https://www.idealista.com/inmueble/30624440/";" ""Impresionante ático dúplex en edificio residencial, 140m² útiles de vivienda, más terraza de 42m², todo exterior, en finca del año 2005, 4 habitaciones dobles, 2 baños, cocina office independiente con galería cubierta, amplio comedor con acceso a terraza, suelos de tarima, armarios empotrados, dos vestidores, carpintería interior en haya, ventanas de aluminio gris climalit, aire acondicionado frío/calor canalizado, puerta acorazada, dos plazas de garaje incluidas en precio. Bonita zona común con piscina, parque infantil, jardín y conserje. Certificado pendiente de confección. Alfahuir 1."" ";"Dúplex en venta en Sant Llorenç, València";"399000";"170";"4";"9ª";"-0.3685462";"39.4893061"
"3";"https://www.idealista.com/inmueble/914694/";" ""RURALREGION TE OFRECE UNA Casa rural de pueblo con 250 METROS DE terreno junto a la casa.Estupendo para hacer huerto,o plantar lo que se desee,cultivarlo,poner piscina,hacer un gran jardín,con posibilidad de meter el coche,etc ?La casa está en una muy buena zona del pueblo en una pequeña plaza,nada de calles angostas.La zona es muy bonita y atractiva porque está junto a la laguna de Gallocanta.La casa está fuerte de estructura y forjados,aunque por dentro haya que reformarla entera.MUY BUEN PRECIO,ECONOMICA.AGREGANOS A TU FACEBOOK PARA ESTAR A LA última DENUESTRAS NOVEDADES."" ";" Casa o chalet independiente en venta en plaza Supervia, 65, Castejon de Tornos";"25000";"130";"3";"Hipoteca 64 eur/mes - ";"-1.427988";"40.9944268"
"4";"https://www.idealista.com/inmueble/1635591/";" ""Urb. Almenara del Guadalquivir, C/ Julián Bazán Boceta, nº 6. Piso de 2 dormitorios, salón independiente, cuarto de aseo, baño incluido en el dormitorio principal y cocina amueblada. Armario empotrado en dormitorio principal. Suelo de grés cerámico, puertas de madera de haya y carpintería de aluminio lacada en blanco con acristalamiento de tipo climalit. Todo exterior, con magníficas vistas al río. Tercera planta, sin ruido. Trastero y plaza de garaje de muy fácil acceso. Piscina comunitaria y club social con diversas actividades. Posibilidad de venta amueblado (consultar) Distribución del edificio: 10 vecinos en el edificio, 3 por plantas."" ";"Piso en venta en calle Julián Bazán Boceta, 6, La Algaba";"99000";"85";"2";"3ª";"-6.0130495";"37.4586877"
"5";"https://www.idealista.com/inmueble/1635945/";" ""FINCA NUEVA DE 5 años, preciosas vistas. Plz de pkg grande, aire acc. por conductos frio/calor, puertas haya serigrafiadas, suelo gres tipo travertino, pers motorizadas y trza de 70 m2. 1ª plnt: Recibidor amplio, tres habt dobles de 15 m2 cada una aprox. , baño completo con bañ, aseo, cocina totalmente equipada de diseño, salón comedor de 30 m2 con salida a balcón. 2ª planta: Habt principal suitte con baño completo, y vestidor a medida. Salón abhd con salida a terraza de 70m2, habt-lavadero. distribución: terraza descubierta de 70 m2 9 vecinos en el edificio."" ";"Dúplex en venta en avenida de la Conca, 8, Sarral";"160000";"180";"5";"3ª";"1.2488953";"41.4418443"
"6";"https://www.idealista.com/inmueble/32168577/";" ""Vivienda ático en edificio de 4 alturas y 9 viviendas en total, distribuida en dos plantas, con entradas desde el exterior independientes en cada una de ellas (3ª y 4ª planta). Esto permite la utilización de la 4ª planta como despacho profesional o como vivienda independiente y al mismo tiempo anexa a la vivienda principal. Vivienda exterior a dos fachadas (ventilación cruzada). • Planta alta con cubierta a dos aguas, altura en cumbrera aproximada de 4 m. Aislamiento térmico especial en cubierta. • Pintura lisa en toda la vivienda. • Puertas blindadas de entrada a vivienda en las dos plantas. • Carpintería exterior en aluminio marrón. Acristalamiento Climalit. • Carpintería interior y rodapiés en DM lacada en blanco. • Armarios totalmente terminados y revestidos en haya. • Estanterías en toda la vivienda de pladur, con revestimiento en superficie de apoyo en formica blanca para facilitar su limpieza. • Falso techos en pladur. • Escalera interior en madera, pasamanos en madera maciza y acero. • Cocina con muebles realizados en formica y aluminio. Trituradora de basuras en fregadero. Encimeras de Silestone antibacteriano. • Baños con mamparas de cristal de seguridad y encimeras en Silestone antibacteriano. • Instalación centralizada de Aire Acondicionado. • Calefacción por suelo radiante (sistema agua), sectorizado en dos plantas. • Placas solares en cubierta para suministro de agua caliente sanitaria. • Descalcificador de agua en toma de entrada general a vivienda, situado en cochera de vivienda. • Dos trasteros (uno por planta) situados dentro de la vivienda. • Terrazas (una por planta) con solado de madera flotante, estanterías realizadas en la misma madera y toldos. • Cochera con dos amplias plazas de garaje, instalación eléctrica propia, ventilación y estanterías metálicas para almacenaje. Puerta automática de casi 5m. Una plaza de aparcamiento exterior a cochera, delante de ésta."" ";"Dúplex en venta en plaza fuente, 9, La Alberca, Murcia";"490000";"240";"4";"3ª";"-1.1386021";"37.9399727"
"7";"https://www.idealista.com/inmueble/1724595/";" ""Casa de campo renovada de piedra, viguería de madera, cocina equipada, diseño: marca gato, smeg etc. Comedor lucernario de 4m2 muy luminoso, puerta salida al jardín, salón abuhardillado de 2, 50mts a 4mts de altura, aprox 30m2, con tres amplios ventanales vistas fenomenales, prados, montes. Dormitorio principal dúplex, abuhardillado con escalera de haya. Dorms, con trastero y escalera propia, c. Baño principal de diseño amplio, wc individual, c. Baño 2. Cerca alceda, puenteviesgo y playas.. . Una segunda cada esta también a la venta.. . Con arco de piedra en fachada.. . Se pueden visitar las dos a la vez. Consultar."" ";" Chalet adosado en venta en camino Carrascal de San Miguel s/n, Luena";"125000";"160";"2";"Hipoteca 320 eur/mes - ";"-3.9023093";"43.0920874"
"8";"https://www.idealista.com/inmueble/1689698/";" ""EL CHALET INDEPENDIENTE MAS BARATO DE LA URBANIZACIÓN ALDEAMAYOR GOLF. También renta de 499 euros mensuales, CON OPCION A COMPRA. - A estrenar, acceso a la parcela gress porcelánico, Chalet Independiente en Aldeamayor Golf, sito C/ Lago Sanabria nº1; urge venta, necesitamos dinero, PARCELA DE 700 M2. , cocina amueblada, 4 DORMITORIOS CON ARMARIOS EMPOTRADOS Y FORRADOS, 2 BAÑOS, HIDROMASAJE, PUERTAS HAYA VAPORIZADA, SUELOS DE mármol, PARCELA 780 M2, VENTANAS de aluminio oscilobatientes con rotura de puente térmico, COCINA AMUEBLADA, cochera para dos coches y trastero, da al campo de golf, abeto de Normandia, cedula fotovoltaica para agua caliente, acceso en gres porcelánico 125 m2. , da al campo de golf nº2, porche de 12 m2."" ";" Casa o chalet independiente en venta en avenida Médulas, 3, Aldeamayor de San Martin";"149900";"180";"4";"Hipoteca 384 eur/mes - ";"-4.6386271";"41.5123619"
"9";"https://www.idealista.com/inmueble/26622069/";" ""Casa en venta 220.000€.Parking con trastero (2-3 coches. 60 m aprox. ) jardín 120 m. 1ª planta: Comedor con balcón salida a jardín con barbacoa, cocina office con lavadero, aseo con plato de ducha y mampara, suelo de gres, escalera de mármol y madera. 2ª planta: 3 hab. (antes 4) terraza. Lavabo completo con bañera. Suelo de parquet. Ventanas de aluminio con mosquiteras, puertas de haya. Calefacción. Toda la casa es exterior. Vistas montaña, zona tranquila y privada de 10 vecinos."" ";" Chalet pareado en venta en calle Tercera Avenida, 11, Torrelles de Llobregat";"220000";"130";"4";"Hipoteca 563 eur/mes - ";"1.9810709";"41.3538823"
"10";"https://www.idealista.com/inmueble/32497112/";" ""Se vende piso en Barrio Oliver (calle Francisco de Ruesta) cerca de todo tipo de comercios y servicios, buena combinación con las lineas de autobuses, zona tranquila de tan solo 4 años de antigüedad.El inmueble tiene 60 m2 construidos y 52 m útiles con la siguiente distribución:Dos dormitorios, salón con cocina equipada y un cuarto de baño con bañera. Terraza de 15 metros situada en la azotea del edificio con agua y luz de uso particular del apartamentoExterior y muy luminoso con orientación sur. Cuenta con un armario empotrado en el dormitorio principal.Calefacción individual a gas.Trastero incluido en el precio de venta de 7 metrosFinca sin ascensor, el piso se encuentra en la primera planta, alturas del edificio: 2.Buenas calidades en la vivienda, Puerta de entrada blindada, puertas interiores de haya vaporizada, ventanas climalit, suelos de pergo, suelos de baño y cocina gres.VEN A VERLO.. . TE GUSTARÁ."" ";"Piso en venta en calle francisco de ruesta, Oliver, Zaragoza";"69800";"60";"2";"1ª";"-0.9202461";"41.6552051"
"11";"https://www.idealista.com/inmueble/32520492/";" ""Vendo vivienda, piso de reciente construcción y en perfecto estado, completamente actualizado sito en 1ª planta, con una superficie construida de 110 m2, 3 habitaciones, comedor de 25 m2 con balcón corrido, 2 baños completos, cocina con galería y terraza de uso privativo de 12 m2 y otra terraza exterior privativa de 26 m2. La vivienda dispone de paredes lisas, toldos, preinstalación de alarma, rejas en todas las ventanas, suelo de mármol, puestas de paso y armarios de haya vaporizada, A/A por conductos y plaza de garaje en el propio edificio de ancho especial."" ";"Piso en venta en calle canonge gisbert, 8, Zona Calle Valencia-La Ermita, Torrent";"165000";"110";"3";"1ª";"-0.4691399";"39.4382059"
"12";"https://www.idealista.com/inmueble/32688428/";" ""Piso seminuevo con 9 años de antigüedad situado en Santa Isabel en una calle tranquila, y a 20 minutos del centro en autobús y con parada a 2 minutos. Planta baja, muy luminoso y tranquilo, exterior a la zona de ocio en una comunidad tranquila de dos alturas, con ascensor, piscina comunitaria y amplia zona común. Consta de dos dormitorios, un de matrimonio y otro doble, amplio salón de 20m2 con cocina americana equipada, electrodomésticos inox. , baño completo de 4 piezas con bañera, cuarto para lavadora equipado, terraza interior de 4 m2 y exterior de 40m2 con barbacoa, césped artificial, jardineras y mobiliario de jardín. Calefacción individual de gas con caldera comunitaria y bomba de calor de 6000 frigocalorías. Calidades de primera: suelos de parquet, puerta blindada, puertas de haya maciza, ventanas climalit con doble cristal y con contraventana de lamas de aluminio, mosquiteras en todas las puertas y ventanas. Garaje y trastero 7m2 con puerta de seguridad. Para entrar a vivir."" ";"Piso en venta en calle san roque, 23, Santa Isabel, Zaragoza";"165000";"65";"2";"Bajo";"-0.8341301";"41.6720957"
"13";"https://www.idealista.com/inmueble/30198893/";" ""Esta casa, diseñada en el siglo XIX por el alcalde y arquitecto valenciano Vicente Alcayne Armengol, presenta una fachada protegida con motivos decorativos, se haya localizada en el centro de Valencia (zona botánico). En 2005 fue llevada a cabo una rehabilitación de la casa y del edificio. Las instalaciones eléctricas y de fontanería son actuales.La casa tiene 270 metros cuadrados más veinte metros de terraza. Está situada en el segundo piso de un edificio de tres plantas y ocupa la planta noble completa. Dentro de sus múltiples usos una parte de la vivienda se dedicó a la fabricación y decoración de abanicos. Parte de la casa mantiene sus vigas originales vistas. En el resto de la vivienda las vigas están cubiertas de escayola con aislamiento acústico.  Las estanterías que se ven en las fotos pertenecieron a la fábrica. De igual modo, en una parte de la casa el pavimento original de barro cocido se ha preservado. El resto del pavimento está recubierto con madera tropical. Durante la reforma aparecieron unas pinturas murales del siglo XIX, probablemente realizadas por el destacado arquitecto que construyó el palacio. Dichas pinturas han sido preservadas.Las puertas interiores de la casa pertenecieron a La Finca Roja. , un emblemático edificio valenciano. Todas las ventanas fueron completamente renovadas y poseen una doble capa de aislamiento. La casa está equipada con un descalcificador y tres equipamientos de aire acondicionado (dos de ellos industriales) con bomba de calor.La casa consta de hall de entrada, salón comedor y cocina. El dormitorio principal posee un baño completo y un vestidor. Tiene también una habitación de invitados con un baño de cortesía, un pasillo, un trastero con una capacidad de 15 metros cuadrados y de un espacio diáfano de 100 metros cuadrados en la actualidad usado como taller de artista. También dispone de una terraza de 20 metros cuadrados con abastecimiento de agua."" ";"Piso en venta en calle de Juan de Mena, 11, El Botànic, València";"495000";"290";"3";"1ª";"-0.3846683";"39.4733584"
"14";"https://www.idealista.com/inmueble/30181397/";" ""Obra Nueva de 75 m2 en Juslivol, barrio de Zaragoza con parada de autobus de tuzsa línea 43 ( Coso - Juslivol ) a pocos metros del portal. Está distribuído en salón de 20 m2 con acceso a terraza, cocina indepediente de 6,75 m2, 2 dormitorios uno de ellos con acceso también a otra terraza y otro dormitorio más tipo suite con baño con plato de ducha y un 2º baño completo con bañera. La vivienda tiene pavimentos parquet flotante en roble y gres ceramico en cocina, baño y aseo, gres ceramico para exteriores en las terrazas, alicatados en cocina, baño y aseo de azulejos ceramicos con cenefas. La carpintería interior en haya, con puerta de entrada blindada y vidrieras en la puerta de cocina y salón. La carpinetría exterior en aluminio lacado con persiana de aluminio y acristalamiento climalit. La cocina va equipada con mobiliario alto y bajo, fregadero, encimera de granito, placa vitroceramica, horno, campana, frigorífico, lavadora y lavavajillas. Tiene calefacción y aire acondicionado por bomba de calor. El agua caliente es individual por placas solares. El edificio dispone de ascensor, portero automatico, garaje y trastero. Es una 2ª planta de 3 alturas. Al precio hay que añadir el 10 % de IVA."" ";"Piso en venta en Pilar Figueras, 14, Barrios rurales del norte, Zaragoza";"147000";"80";"3";"2ª";"-0.8973041";"41.6924571"
"15";"https://www.idealista.com/inmueble/30184266/";" ""Piso, parking y trastero en venta en Reus, calle Menta no1, 4o 1a (al lado de la comisaría de los Mossos de Esquadra) de 110m2 de superfície útil (126m2 de superficie construida) compuesto por:- Cocina de 11 m2 con espacio para mesa equipada con vitrocerámica, nevera, horno, microondas, lavavajillas.- 4 habitaciones:- 1 habitación doble de 11 m2- 1 habitación doble de 10 m2 con armario empotrado- 1 amplia habitación/estudio de 13 m2 convertible en dos habitaciones individuales- 1 habitación doble de matrimonio de 12 m2- 2 baños con bañera y bidet- Amplio salón-comedor de 27 m2- Cuarto con toma de agua y desagüe para instalación de lavadora y equipado con armarios- Terraza de 6 m2 orientada a la zona comunitaria- Recibidor y pasillo distribuidorCaracterísticas principales del piso:- Año de construcción: 1998- Zona comunitaria con jardín y piscina- 4 habitaciones, salón y cocina exteriores y soleadas- Orientación de las dependencias exteriores: Este/Oeste- Aire acondicionado con 3 splits distribuidos en salón, pasillo común y habitación de matrimonio (instalado en 2005)- Calefacción de gas natural- Potencia eléctrica contratada: 4,4kW- Carpintería exterior de aluminio con doble cristal- Doble ventana en habitación de matrimonio- Carpintería interior nueva en 2004 chapada en madera de haya- Pintura interior renovada completamente (paredes y techos) en 2012- Piso amueblado excepto el salón- Opción a una 2a plaza de parking en el mismo edificioCaracterísticas principales del parking y trastero:- Rampas de acceso al parking situadas en C/Menta (salida) y C/Heura (entrada)- Parking de 15 m2 en el mismo edificio- Trastero al lado del parking."" ";"Piso en venta en calle Menta, 1, Ponent, Reus";"190000";"126";"4";"4ª";"1.0945733";"41.1582102"
"16";"https://www.idealista.com/inmueble/31664339/";" ""Venta o alquiler con opción a compra. Urbanización residencial en excelente situación, tranquila pero muy cerca del centro de la capital, con 2 piscinas, zonas de ocio privadas y pistas deportivas. Casa construida en 2007 por Bekinsa, orientación sur, muy soleada. Entrada con porche y jardín. Sótano con plaza de garaje, trastero, bodega y habitación auxiliar. En planta principal está el salón con chimenea cerrada y forrada en piedra, aseo, cocina y gran patio con despensa-lavadero. 3 dormitorios y dos baños completos en la 2° planta (uno dentro de la habitación principal). Buhardilla y trastero en planta superior. Excelentes calidades: portón blindado, puertas interiores en madera de haya, armarios empotrados en las tres habitaciones, suelos de mármol y tarima flotante, aire acondicionado con bomba de calor, toldos.. . Se vende reformado y totalmente amueblado, con mobiliario en madera maciza hecho a medida y cocina de Forlady."" ";" Chalet adosado en venta en calle poeta josé manuel de lara, 7, Marismas del Polvorín, Huelva";"235000";"198";"5";"Hipoteca 602 eur/mes - ";"-6.9321344";"37.2534272"
"17";"https://www.idealista.com/inmueble/33000590/";" ""REF. MC1934-12CGPiso en 1ª linea de playa en Cubelles zona Clot del basso.DISTRIBUCIÓN:- 2 habitaciones (1 habitaciones dobles, 1 sencilla)- 1 grand baño completo.- Cocina equipada- Salón - comedor de 25m2 con salida a terraza de 26 m2.- Ascensor directo desde el parkingCALIDADES:- Propiedad en muy buen estado- Suelos de gres- Carpintería exterior de aluminio- Carpintería interior de haya- Calefacción en todas las estancias, aire acondicionado. - Gran zona comunitaria con 2 piscinas, parque infantil, jardines.ZONA Y TRANSPORTE:1ª línea de playa, con inmejorables vistas al mar. Todos los servicios a su alcance: comercios, colegios, institutos y transporte público. Estará a tan sólo a 10' tanto del tren (RENFE) como de la parada de autobús.Ambos transportes tienen parada en el popular municipio costero de Sitges, Barcelona y aeropuerto.¡Crea tu nuevo hogar en una de las zonas más exclusivas de Cubelles y disfruta de los atardeceres viendo el mar!."" ";"Piso en venta en Pla de Sant Pere-Les Salines, Cubelles";"180000";"75";"2";"1ª";"1.6637967";"41.1958392"
"18";"https://www.idealista.com/inmueble/28504916/";" ""Preciso ático dúplex de 130m² con 4 habitaciones (3 dobles) y 2 baños completos (1 suite). Todo al más mínimo detalle, perfecta distribución y gran luminosidad casi todo el día.Suelos parquet, calefacción, aire acondicionado, puerta blindada, ventanas de aluminio y puertas de haya.Grandes calidades y posibilidad de muebles de alto standing.Tiene una gran terraza de 50m² y 3 balcones. Además incluye garaje grande y un trastero de 10m².Tiene vistas a la calle y una orientación excelente.Vas a dejar de verlo?."" ";"Piso en venta en Urb. CASC ANTIC, Centre, Ripollet";"292500";"130";"4";"2ª";"2.1551661";"41.5014587"
"19";"https://www.idealista.com/inmueble/28985021/";" ""Ref. MCM271RRCasa semi nueva, con bonitos acabados, puertas de haya, aluminio, suelos de gres, calefacción, aire acondicionado, riego automático, chimenea, barbacoa, bonitas vistas, parcela de 850 m2, con:- Cuatro dormitorios dobles y todos ellos con armarios empotrados, exteriores y con bonitas vistas.- Dos baños completos amplios y exteriores.- Amplia cocina equipada exterior de diseño.- Salón con salida al jardín con chimenea.- Garaje 35 m2. para dos coches, trastero.- Porche de 31 m2 más tres terrazas.- Jardín con piscina con depuradora, riego automático, barbacoa, porche.Todo en dos plantas: planta, salón, cocina, baño, dos dormitorios, garaje, jardin. Primera p. dos dormitorios, baño y tres terrazas.SERVICIOS Y TRANSPORTEEs una urbanización que sipone de restaute y zona deportiva comunitaria, proxima al pueblo que dispone de servicio, colegios, comercios, ambulatorio, a 18' de Manresa y 25' de Tarrassa, y buena conexion con la autopisa de Manres-Barcelona.Es mejor verla, no duden en llamar y le acompañaremos encantados."" ";" Casa o chalet independiente en venta en Castellbell i el Vilar";"298000";"238";"4";"Hipoteca 763 eur/mes - ";"1.8238503";"41.6464011"
"20";"https://www.idealista.com/inmueble/29544430/";" ""REF: MCC-932-MJBonito y espacioso piso semi nuevo bien ubicado en la zona nueva L´Arboç;- 4 Dormitorios (3 de ellos dobles).- 2 Cuartos de baños completos (uno con bañera y otro con plato de ducha).- Cocina amueblada.- Salón comedor con salida a terraza con bonitas vistas.- Despensa grande.- Parking con trastero.CALIDADES- Puertas interiores de haya.- Puertas exteriores de aluminio.- Puerta de entrada blindada.- Suelo de gres.- Calefacción en todo el piso.ZONA Y TRANSPORTES:Zona tranquila con todos los servicios cerca autobús, estación de tren, piscina municipal, médicos, campo de futbol, supermercados, colegios, parques infantiles….Venga a verlo, le va a gustar!."" ";"Piso en venta en L'Arboç";"134114";"100";"4";"3ª";"1.5944398";"41.2623795"
"21";"https://www.idealista.com/inmueble/30087557/";" ""972-12 TABonita casa en Sant pere de ribes,- 4 Dormitorios (2 Dormitorios dobles 1 con armario empotrado y salida a terraza y 2 Dormitorios simples).- 2 Cuartos de baños.- Salón comedor con salida a terraza.- Cocina amueblada con amplio lavadero.- Garaje para 2 coches y con 3 amplias habitaciones.- Jardín de 80 metros.CALIDADES:- Puertas interiores de haya.- Puertas exteriores de aluminio.- Calefacción y aire acondicionado.- Suelos de gres, parquet y mármolZONA Y TRANSPORTE:Buena zona a 5´del centro con supermercados, colegios, medico ayuntamiento a 2´del gimnasio, piscina, parada de autobús a 5´ andando en todas direcciones, vivirá con tranquilidad con bonitas vistas a la montaña a 30´de Barcelona. Véala le va a gustar!."" ";" Chalet adosado en venta en Centro Pueblo, Sant Pere de Ribes";"362000";"165";"4";"Hipoteca 927 eur/mes - ";"1.769733";"41.2585303"
"22";"https://www.idealista.com/inmueble/30037428/";" ""REFERENCIA: MCC965-GHDISTRIBUCIÓN:- Casa en planta- 4 habitaciones dobles con armarios empotrados, una en swuit- 2 baños completos con plato de ducha- 1 Amplia coicna de 15 m2 totalmente equipada- Salón comedor de 25 m2 con salida a terraza de 18 m2 y chimenea- Planta baja- garaje para 4 coches mas una habitación doble y un baño completo- Casa en el jardín para guardar los apareos de mantenimiento del jardín al lado de la barbacoa- Piscina sobre puesta de 3X6X1,20CALIDADES:- Suelos de gres- Carpinteria exterior de aluminio climalit con mosquiteras- Carpinteria interior demadera de haya maziza- Todas las instalaciones son nuevas del año 2011 sin extrenar.ESTADO:- Para entrar a vivir- La casa es nueva, se ha usado un par de veranos.ZONA:- Calafell Park es una urbanización muy tranquila y al mismo tiempo a diez minutos del centro de Calafell, supermercados, playa, Hospitales y todo tipo de servicios."" ";" Casa o chalet independiente en venta en Calafell Parc - Mas Romeu, Calafell";"3e+05";"300";"4";"Hipoteca 768 eur/mes - ";"1.5938748";"41.2287632"
