"";"URL";"Info";"Direccion";"Precio";"Superficie";"Habitaciones";"Planta";"Longitud";"Latitud"
"1";"https://www.idealista.com/inmueble/1778275/";" ""Vivienda seminueva (Oct. 2006) parcialmente amueblada, dos habitaciones dobles, cocina equipada e independiente, 1 baño completo y amplio, comedor muy grande 28m2 con salida a un balcón tipo terraza. También estaría disponible el aquiler con opción a compra (negociable) o alquiler (400€ + parking 50€)Aire acondicionado (caliente y frío) en el salón.Suelos de gres, carpintería interior de haya, exterior aluminio y plaza de garaje incluida en el precio. La habitación de matrimonio tiene además salida a un balcón. Finca con ascensor y completamente exterior , sol todo el día y con vistas al río de Llobregat y a la montaña. Muy próximo a la estación FGC y a 30 min. aprox. de BNC.Posibilidad de cambiar por piso/ casa en el Baix de Llobregat, principalmente Gavá, Castelldefels y Viladecans."" ";"Piso en venta en calle Lluís Companys, 7, Monistrol de Montserrat";"160000";"80";"2";"4ª";"1.8464648";"41.611353"
"2";"https://www.idealista.com/inmueble/25759044/";" ""Precioso piso en urbanización almenara del guadalquivir:- 2 habitaciones, una de ellas con armario empotrado (forrado con madera maciza de pino) y acceso a la terraza. - 2 baños con sus mamparas correspondientes (baño de dormitorio principal con muebles de madera maciza de pino). - Cocina totalmente amueblada con madera de roble francés. - Salón amplio de aproximadamente 19 metros cuadrados. - Terraza de 6 metros cuadrados con dos toldos.Todas las ventanas disponen de rejas con cerradura y mosquiteras. Puertas de madera de haya y carpintería de aluminio lacada en blanco con acristalamiento de tipo climalit. Salón y dormitorio con aire acondicionado.Trastero de 5, 20 metros cuadrados y plaza de garaje.Piscina comunitaria y club social con diversas actividades.Exterior, con vistas al río y al parque de la urbanización. A 5 minutos de Sevilla."" ";"Piso en venta en calle Julián Bazán Boceta, 6, La Algaba";"135000";"80";"2";"1ª";"-6.0111303";"37.4568588"
"3";"https://www.idealista.com/inmueble/31577207/";" ""3 dormitorios nuevo y entero amueblado. Para entrar a vivir. Baño completo y aseo. Salón muy amplio y luminoso. Armario hecho a medida en dormitorio principal en haya, roble y cristal. Cocina con electrodomésticos y amueblada en roble y silestone, con lavadero incorporado a la cocina. Plaza de garaje muy grande y piscina comunitaria en la azotea. Cierres en aluminio y puerta blindada. No se ha alquilado nunca, solo han vivido en periodos cortos de tiempo los dueños. Se puede ver en persona. Posible precio negociable. Playa a un kilometro."" ";"Piso en venta en calle nati mistral, 12, Roquetas Centro, Roquetas de Mar";"165000";"95";"3";"1ª";"-2.61461";"36.75836"
"4";"https://www.idealista.com/inmueble/33898247/";" ""Se trata de un piso en tercera planta, totalmente reformado preparado para entrar a vivir, todo su inmobiliario es de primera calidad, puertas de paso maciza en color haya, armarios empotrados forrados y equipados con madera de calidad, suelo de tarima flotante de nivel 5, ventanas de climalit lacadas en blanco con mosquiteras, cocina amueblada, portón blindado y acorazado, paredes y techos de perlita, internet en las habitaciones, los mecanismos eléctricos están catalogados de lujo y los dos cuartos de baños estan reformados. Recomiendo mejor ver es una ganga."" ";"Piso en venta en avenida de la constitución 1,978, 20 3-C, Camposoto - Gallineras, San Fernando";"125000";"83";"3";"3ª";"-6.20749";"36.4517"
"5";"https://www.idealista.com/inmueble/29192899/";" ""ABSTENERSE INMOBILIARIAS. Séptima planta con ascensor en perfecto estado, todo exterior, esquina, uno por planta, muy luminoso. Se vende equipada por cambio de domicilio. Tiene climatizador por zonas, Confort Zone y toldos en toda la vivienda. Tres habitaciones, dos baños. Armarios empotrados y puertas en haya. Amueblado. Instalación de video en todas las habitaciones y preinstalación de hilo musical en toda la vivienda."" ";"Piso en venta en calle Tinent Ganga, 68, Corazón de Jesús, Elche / Elx";"115000";"98";"3";"7ª";"-0.7058296";"38.2670595"
"6";"https://www.idealista.com/inmueble/29171174/";" ""Casa practicamente nueva de una planta, con garaje en planta semisotanos.Gran salon-comedor,cocina, suite con baño incorporado y dos habitaciones mas con baño.Casa muy bien aislada en cubierta y paredes, buen comportamiento térmico con ventilación cruzada y ventilación permanente.Caldera mixta de gas-oil para agua caliente sanitaria y instalación bitubular con radiadores de aluminio.Suelos de porcelanato de alta resistencia, carpinterias de haya y aluminio con rotura de puente termico en exteriores.Persianas de lamas de aluminio correderas de protección solar.Armarios empotrados."" ";" Casa o chalet independiente en venta en calle Riu Fluvià, 15, Vidreres";"230000";"150";"3";"Hipoteca 589 eur/mes - ";"2.813285";"41.8015726"
"7";"https://www.idealista.com/inmueble/2075845/";" ""Casa pareada en zona tranquila muy soleada. Garaje de 60m2 (para 3 coches).PB: Cocina, aseo i comedor sala de estar con salida al jardín. Suelos de gres.Planta 1a: Suite con vestidor y baño, 1 habitación doble y 1 individual, 1 baño. Suelos de parquet de haya. Armarios empotrados, calefacción gas, carpinteria exterior de aluminio con puente térmico, carpinteria interior de haya, puerta blindada, vidrios dobles. Construcción año 2004. Agua (de alta), gas (de alta), luz (de alta). la casa dispone de: portero automático"" ";" Chalet pareado en venta en calle el Campet, 23, Folgueroles";"245000";"144";"3";"Hipoteca 627 eur/mes - ";"2.3146091";"41.9390832"
"8";"https://www.idealista.com/inmueble/1755650/";" ""Magnifica oportunidad para adquirir un chalet, con una superficie total de la parcela de 4155 m2. entre los cuales se haya ubicado un chalet de aprox. 85 m2 con vistas hacia el monte.El Chalet se encuentra amueblado, con mucha luminosidad y distribuido en: -Salón-comedor con chimenea.-Cocina.-2 Habitaciones dobles de 2 x 4 mts.-1 Aseo.-Trastero y posibilidad de ampliación de vivienda. El chalet dispone de una terraza de aprox. 18 m2. así como Barbacoa. distribución: terraza descubierta de 18 m2 la casa dispone de: portero automático"" ";" Casa o chalet independiente en venta en Partida del Calderon, 5, Chella";"65000";"85";"2";"Hipoteca 166 eur/mes - ";"-0.6616848";"39.0422861"
"9";"https://www.idealista.com/inmueble/1922070/";" ""Céntrico dúplex seminuevo parquing trastero. 175m, todo exterior y muy soleado con vistas al parque natural, 4 habitaciones (2 dobles), baño con bañera hidromasaje, cocina office, aseo, estudio con salida a 2 terrazas de 47m, calefacción y a/a, gres, puertas de haya, ventanas de aluminio, comunidad de sólo 9 vecinos, cerca de comercios, colegio, transporte público. Venga a verlo sin compromiso, le encantará! Distribución: Terraza descubierta de 47 m2 3 vecinos en el edificio La casa dispone de: Portero automático"" ";"Dúplex en venta en avenida Catalunya, 35, Sant Llorenç Savall";"178000";"175";"4";"2ª";"2.0589472";"41.6790875"
"10";"https://www.idealista.com/inmueble/27943660/";" ""se vende la vivienda. se compone de muy buenos materiales como:ventanas de pvc con cámara de gas de 14 y doble acristalamiento,descalificador para toda la vivienda junto con la ósmosis.aire acondicionado calefacción a gas natural con termostato.despacho librería hecho a medida.puerta acorazada de entrada.todas las puertas de vivienda de haya recien puestas. el piso se puede ver sin compromiso. además hay un local de 40 m2 se podria vender aparte por 30 mil € con baño , puerta automatica, salida de humos, instalacion de telefono e internet, vivienda más local, son 15 mil €"" ";"Ático en venta en calle Josefa Aynat Amorós, 3, Biar";"120000";"95";"4";"3ª";"-0.7621519";"38.6270888"
"11";"https://www.idealista.com/inmueble/27917838/";" ""Piso con solo 6 años, consta de 67m2, dos habitaciones, un baño, salón, cocina office, recibidor con pequeño trastero. Todo exterior y muy luminoso.Suelo de gres, puertas de haya, con calefacción, aire acondicionado, amplia bañera con mampara y fácil acceso, maquina para osmotizar el agua instalada.Con posibilidad de dejar algún mueble si se desea.Cerca de colegios, supermercados, en la misma calle del Parc Central del Vallés, bus justo delante del piso, próximo a la estación de RENFE Sud, salida rápida a la autovía por Barberá del Vallés. Precio Negociable, infórmese."" ";"Piso en venta en ronda de Pau Vila, 38, Creu de Barberà, Sabadell";"180000";"67";"2";"2ª";"2.1167008";"41.5231403"
"12";"https://www.idealista.com/inmueble/29472609/";" ""Terreno liso de 705m2 con: Una casa unifamiliar construida el año 2007 de 284m2, una casita de obra de 16m2, barbacoa exterior con techo y piscina, muy bien situado cerca de todo. Parquet de cerezo en toda la casa excepto cocina, lavadero y baños, puertas en haya vaporizada lisas, chimenea cerrada en el comedor, calefacción en toda la casa.La casa consta de planta sótano: Con un garaje de 60m2 y 42m2 repartidos entre la sala de maquinas, acceso a la vivienda y habitación grande.Planta baja a la altura del terreno consta de: Un comedor de 38. 90m2, un baño con ducha de 3. 30m2, una habitación de 15. 20m2, una cocina de 17. 15m2 y un lavadero de 3. 93m2 con salida a terraza.Planta 1ª consta de: Un distribuidor, dos habitaciones de 11. 02m2 con armarios empotrados forrados en madera y salida a terraza, una habitación de 5. 06m2, un baño completo con bañera de 6m2 y una habitación suite de 16. 42m2 con salida a terraza, baño completo con bañera de 6. 58m2 y un vestidor amueblado con puerta corredera de 4. 89m2."" ";" Casa o chalet independiente en venta en calle Sant Jordi, urbanización California, 16, Canyelles";"3e+05";"284";"5";"Hipoteca 768 eur/mes - ";"1.7258019";"41.2767172"
"13";"https://www.idealista.com/inmueble/30495789/";" ""(OCASIÓN) COMO NUEVO!!!Se vende apartamento de un dormitorio y cocina americana, completamente amueblado, en la localidad de Águilas (Murcia).Dormitorio con cama de matrimonio, armario de cuatro puertas y tocador con espejo, todo en color cerezo.Cocina con armarios altos y bajos, mueble escobero, mueble para calentador, nevera encastrada en el mismo mueble, lavadora encastrada en mueble bajo, campana extractora de 90 cm. Vitrocerámica microhondas sobre encimera, y luminarias en techo. Comedor con sofá cama y pub. Mueble para la tele y estanterías. Baño con bañera de 1,50 metros. Lavabo con pie, water, bidet y espejo con luminarias. Aire acondicionado con bomba de calor. Soleria de gres y puertas de haya maciza.Precio: 60.000 € Sin regateo.Superficie: 35 m2. Útiles.Posibilidad de cambiar por otro mas grande pagando la diferencia."" ";"Piso en venta en calle Sevilla, 6, Casco Antiguo, Águilas";"60000";"35";"1";"3ª";"-1.5885226";"37.409913"
"14";"https://www.idealista.com/inmueble/32326766/";" ""Planta baja con terraza, jardín y garaje. Orientación sur. Construcción con menos de 5 años. Zona tranquila y céntrica del precioso pueblo de Escalante, con todos los servicios. Construcción nueva al estilo montañés, fachada norte de piedra y detalles de sillería. Cómodo acceso al garaje y al exterior desde el jardín. Preciosa cocina nueva y equipada con alta gama. Distribución modificada en obra, zona cocina-comedor-salón muy especial, con acceso a terraza y jardín. Dos habitaciones y dos baños. En proyecto tenía 3 habitaciones pero opté por ampliar cocina-salón y se podría hacer una habitación más fácilmente. Se realizaron muchas mejoras en obra, a capricho: suelo laminado AC4, puertas correderas de haya, puerta blindada, etc. Acogedor y moderno. Playa de Berria 4 km, opción carril bici, playas de Noja 6 km. Santoña 6 km."" ";"Piso en venta en calle mayor, 12, Escalante";"165000";"95";"2";"Bajo";"-3.5125527";"43.4362926"
"15";"https://www.idealista.com/inmueble/31118172/";" ""PISO EN VALLHERMOSO CON GRAN TERRAZA DE 140 m2 CON SALIDA DESDE COMEDOR Y DORMITORIO!!!!! Ahora tienes la oportunidad de vivir en una de las mejores zonas de Mollet, a menos de 5 minutos andando del centro, de la estación de tren y de todos los servicios; ¡Disfruta de una gran terraza todo el año gracias a su orientación.Piso seminuevo, primera planta con ascensor. Orientación Sur. Parquing en el mismo edificio e incluido en el precio. Totalmente exterior, excepto el baño. Comedor con acceso directo a terraza esquinera de 140 m2 y a balcón de 9 m2. Aire acondicionado. Calefacción gas natural. Cocina independiente con zona de lavadero. Baño completo con bañera. Dormitorio de matrimonio con armario empotrado, aire acondicionado y acceso directo también a la terraza. Dormitorio individual, más un espacio exterior en una caseta en la terraza totalmente acondicionada como habitación (instalación eléctrica, techo de madera, ventanas correderas).En la terraza se encuentra también una caseta más pequeña de PVC a modo de trastero.Detalles: Suelos de parquet y carpintería interior de haya vaporizada. Carpintería exterior de aluminio con ventanas de doble cristal tipo Climalit. Doble ventana en los 2 dormitorios con persiana eléctrica con mando a distancia. Aire acondicionado. Toldo motorizado en terraza con mando a distancia y sensor de viento. Toldos manuales en balcón. Césped artificial en parte de la terraza (40 m2), riego automatico instalado.....un solo propietario. No dudes en visitarlo, sin compromiso!!!"" ";"Piso en venta en ronda de can fàbregas, 18, Centre, Mollet del Vallès";"185000";"68";"2";"1ª";"2.2180336";"41.5367965"
"16";"https://www.idealista.com/inmueble/26721413/";" ""Consta de recibiddor con vestidor para abrigos, calzado, equipaje; cocina muy amplia con todos los electrodomésticos de 1ª gama, salón-comedor, 2 dormitorios (1 armario empotrado, 1 armario exento), y cuarto de baño. Suelos de tarima y puertas interiores en haya, puerta principal blindada, a/a frío- calor, plaza de garaje."" ";"Piso en venta en avenida Damián Téllez Lafuente, 4, Maria Auxiliadora - Barriada LLera, Badajoz";"150000";"70";"2";"4ª";"-6.9735699";"38.8687456"
"17";"https://www.idealista.com/inmueble/25680236/";" ""Piso muy luminoso, salón amplio y luminoso con terraza acristalada anexa, habitaciones amplias, situado a 15 minutos andando del centro, cerca del Hospital Carlos Haya, paradas de autobuses con conexiones a la Universidad, centro, Hospital Clínico, Puerto de la Torre, Materno, etc. Ascensor, azotea y patio comunitario."" ";"Piso en venta en calle Alfredo Nobel, 3, Carranque - Hazas Nuevas, Málaga";"1e+05";"64";"2";"4ª";"-4.4404754";"36.720863"
"18";"https://www.idealista.com/inmueble/31295010/";" ""Piso de dos habitaciones mas salón, baño, cocina, cuarto trastero y dos terrazas. Suelo de parquet, puertas de haya, calefacción individual y preinstalación de aire acondicionado. Situado en la mejor zona de av. América, rodeado de zonas verdes y comunicado con seis líneas de autobús. Edificio de ocho años de construcción. Precio negociable"" ";"Piso en venta en avenida de américa, 107, Barrio Torrero, Zaragoza";"147000";"65";"2";"2ª";"-0.8865035";"41.6272827"
"19";"https://www.idealista.com/inmueble/30818715/";" ""Piso luminoso, seminuevo de 3 habitaciones y 2 baños (1 en suite, de mármol con bañera de hidromasaje), puertas de haya, suelo de parquet, aire acondicionado de 3000 frigorías. Cocina de diseño con electrodomésticos en acero inoxidable Siemens (horno, nevera, microhondas, encimera, campana y lavavajillas integrado), encimera de Silestone. Vistas a Zona comunitaria ajardinada muy tranquila. Comunidad de 14 vecinos bien avenida. Parquin incluido en el precio. Buena comunicación y acceso a autopistas. Colegio y Cap ambulatorio muy cerca. A menos de 10 minutos de ferrocarriles catalanes."" ";"Piso en venta en calle doctor ferran, 13, Can Alzamora - Les Torres - Can Fatjó, Rubí";"165000";"75";"3";"1ª";"2.0357717";"41.4810493"
"20";"https://www.idealista.com/inmueble/29949286/";" ""Casa a cuatro vientos, nueva a estrenar, distribución muy cuadrada, acabados de primera calidad, suelo de gres, puertas en haya vaporizada, aluminio con climalit, antena y teléfono en habitaciones, calefacción por conductos de chimenea, a sólo veinte minutos de Barcelona, magníficas vistas, acabada en obra vista y piedra, terreno con arboles frutales, no deje de verla no perderá el tiempo, de particular a particular. Sólo venta."" ";" Casa o chalet independiente en venta en urbanización Cesalpina s/n, Santa Coloma de Cervelló";"3e+05";"145";"3";"Hipoteca 768 eur/mes - ";"2.0176494";"41.3677811"
"21";"https://www.idealista.com/inmueble/1628882/";" ""¡IMPECaBle! TOTALMENTE REFORMADO (ver fotos) . ALTURA. SOLEADO. MAGNÍFICAS VISTAS! EXCELENTE ubicación ¡a 5 min del centro caminando! ¡LISTO PARA ENTRAr! Puertas de madera de haya y acristaladas. ventanas doble cristal, muy muy tranquilo. DOs habitaciones una doble. Instalación Telecable. Portal, escaleras, ascensor y tejado reformados. Pregúntame cualquier duda por email o tlf. Abstenerse agencias distribución: 2 vecinos en el edificio"" ";"Piso en venta en calle Marcelino Suarez, 10, Vallobín, Oviedo";"140000";"52";"2";"8ª";"-5.8623665";"43.3644396"
"22";"https://www.idealista.com/inmueble/1644613/";" ""Ático-dúplex a estrenar; edificio de un año de antigüedad con mucha luz, orientado al mar; excelentes calidades, cerramientos de climalit, puertas interiores madera de haya, buena distribución, en una zona nueva y tranquila de Puzol, municipio próximo a Valencia, a 15 min del Centro de la ciudad por autovía y a 8 min de Sagunto. bien comunicado. distribución: terraza descubierta de 30 m2 4 vecinos en el edificio."" ";"Dúplex en venta en calle Miajadas, 20, La Barraca-Santigons, Puçol";"190000";"140";"3";"2ª";"-0.3045796";"39.6133529"
"23";"https://www.idealista.com/inmueble/32320227/";" ""Piso céntrico totalmente reformado, tarima, Climalit, electricidad y fontanería nueva, puerta blindada, pintura lisa, puertas de haya. Situada frente a glorieta. Venta sin intermediarios"" ";"Piso en venta en calle valencia, 1, Orihuela Pueblo, Orihuela";"110000";"130";"4";"2ª";"-0.9447006";"38.08165"
"24";"https://www.idealista.com/inmueble/30761464/";" ""Piso en Can Cuyàs, 3 hab., lavabo reformado , persianas eléctricas nuevas y ventanas de aluminio, parquet de haya, puertas de haya combinado con cedro, calefacción eléctrica nueva con mando a distancia, muy buen estado , para entrar a vivir ya. Metro L11, autobús 62,76,155,103."" ";"Piso en venta en santelvira, 16, Can Cuiàs, Montcada i Reixac";"105000";"75";"3";"4ª";"2.17203";"41.4629"
"25";"https://www.idealista.com/inmueble/1658335/";" ""Ático totalmente reformado. Ideal parejas. Parquet, puertas de haya, salón de 25m, terraza de 15m con trastero. cocina y baño de diseño. Muy luminoso. Finca tranquila. Pocos vecinos distribución: terraza descubierta de 15 m2 1 vecinos en el edificio"" ";"Ático en venta en calle Mare de Déu de Lorda, 15, La Trinitat Vella, Barcelona";"2e+05";"85";"2";"4ª";"2.191966";"41.4508759"
"26";"https://www.idealista.com/inmueble/2015712/";" ""zONA cARLOS hAYA, INDEPENDIENTE, BUENA ORIENTACIÓN Y COMUNICACIÓN, GRANDES ESPACIOS ABIERTOS, TE GUSTARÁ VEN A VISITARLA, TIENE MUCHAS POSIBILIDADES PARA NEGOCIOS. distribución: terraza descubierta de 170 m2 la casa dispone de: portero automático"" ";" Casa o chalet independiente en venta en calle Victoria Kent, 24, San Alberto - La Alcubilla - Florisol, Málaga";"340000";"330";"5";"Hipoteca 871 eur/mes - ";"-4.451069";"36.726497"
"27";"https://www.idealista.com/inmueble/26746259/";" ""Magnifico apartamento amueblado con muy buenas calidades; tarima flotante, carpinteria de haya, mampara en el baño con columna de hidromasaje. Aprovechate de las ayudas a la vivienda y haz que tu alquiler se te quede en 210 ?/mes!  Distribución: Terraza descubierta de 12 m2 3 vecinos en el edificio La casa dispone de: Portero automático"" ";"Piso en venta en calle la Guindalera, 2, Zaratan";"1e+05";"50";"1";"Entreplanta";"-4.7856265";"41.6581968"
"28";"https://www.idealista.com/inmueble/29303901/";" ""Piso como nuevo en Vilanova i la Geltrú, dispone de amplio vestíbulo de entrada, comedor salón cocina en espacio abierto, dormitorio individual y dormitorio suite con baño, armarios empotr., A.A y calef. terraza muy grande, parquet, puertas haya, etc,. para verlo...perfecto. Plaza de parking de 11,20m2 y trastero 6,5 m2, en la misma finca, con acceso desde el ascensor, incluido en precio."" ";"Piso en venta en calle de Cristòfol Raventós, 1, Les Casernes - Sant Jordi, Vilanova i la Geltrú";"186000";"113";"2";"4ª";"1.73162";"41.2254099"
"29";"https://www.idealista.com/inmueble/29297078/";" ""Piso recién reformado con mucha luz hay sol todo el día, puertas de haya maciza decapado beige muy bonitas, ventanas de climalit ahorro energetico y aisla del ruido, cuarto piso viene a ser como un tercero, el centro de salud al lado , tahona, tienda de ultramarinos, barrio muy tranquilo,gastos de comunidad incluidos.DISPONIBILIDAD A PARTIR DE AGOSTO. PROYECTO DE ASCENSOR."" ";"Piso en venta en Grupo Cidacos, 5, Tafalla";"120000";"115";"3";"4ª";"-1.6745895";"42.5329262"
"30";"https://www.idealista.com/inmueble/29315419/";" ""Piso en cabra del camp (Tarragona) segundo piso, 70 m2, garaje comunitario 17 m2, buardilla de 30m2, todo reformado nuevo, puertas macizas de haya, gres, armarios empotrdados en todas las habitaciones, ideal para veranear, temperatura muy agradable en verano, clima seco y fresco, a 30 km. De Tarragona y 60 de lerida, consultar, Jordi ."" ";"Piso en venta en Raval la Creu, 21, Cabra del Camp";"98000";"70";"3";"2ª";"1.27517";"41.39599"
