"";"URL";"Info";"Direccion";"Precio";"Superficie";"Habitaciones";"Planta";"Longitud";"Latitud"
"23";"https://www.idealista.com/inmueble/29560198/";" ""Casa de lujo ubicaba en el corazón de Sant Andreu de Llavaneres, consta de una parcela de 1500m2 y 752m2 de vivienda distribuida en planta sótano con superficie de 379.16 m2, planta baja con superficie de 297.80m2 con patio interior de 49,25 m2 y planta estudio con superficie de75,04 m2. La casa se haya rodeada de una gran zona ajardinada, donde se puede apreciar una piscina con jacuzzi y una piscina infantil, combinada con zona de juegos, zona de comedor exterior, zona de relax y chill-out que proporcionan un bienestar familiar al aire libre, disfrutando del entorno y clima mediterráneo. la vivienda esta distribuida en tres alturas, comunicadas entre ellas mediante una escalera central y un ascensor panorámico acristalado. En Planta Sótano, disfrutaremos de un gran espacio destinado a garaje para seis vehículos, una zona de juegos con billar, futbolín, diana, maquina recreativa. Sala de cine familiar con todo el equipamiento necesario, proyector y pantalla escondida en el techo, baño de cortesía con gran ducha, mecanismos control y un LOFT destinado a servicio o invitados, con cocina, baño y salón-dormitorio. En la Planta Baja, hallamos una gran sala de estar acogedora y complementada con mecanismos de control acústico, termostatos temperatura, persianas eléctricas, iluminaciones ambiente etc. la planta baja también dispone de estancias reservadas a comedor, cuatro dormitorios dobles, un baño completo independiente así como cocina-comedor de diseño, totalmente equipada con los mejores electrodomésticos del momento y en la misma planta hay instalada una gran suite compuesta de vestidor doble y baño completo diseñado con plato de ducha enrasado al suelo de gran superficie decorado con piedra natural, por todo ello las estancias están destinadas en su totalidad a la actividad principal del hogar. La Planta estudio esta compuesta de una sala diáfana, abuhardillada abierta a diferentes usos como gimnasio etc.. . con acceso a una terraza con vistas a toda la parcela, y en la que podemos disfrutar de una sauna."" ";" Casa o chalet independiente en venta en Sant Andreu de Llavaneres";"2300000";"752";"5";"Hipoteca 5.896 eur/mes - ";"2.48422";"41.5738599"
"24";"https://www.idealista.com/inmueble/29426985/";" ""REFERENCIA: MCC- 917 –MJPlanta baja de 111 metros con acabados de muy alta calidad, listo para entrar a vivir con zona comunitaria con piscina, zona de juego para niños y terraza privada de 50 metros:- 3 Dormitorios con con armarios empotrados- 2 Cuartos de baño completos nuevos- Cocina completa nueva - Salón comedor de 25 metros con salida a terraza de 50 metros.- Parking para coche grande- TrasteroCALIDADES:- Calefacción y aire acondicionado en todo el piso por conductos.- Puertas de haya.- Carpintería exterior de aluminio.- Suelo de parket. ZONA Y TRANSPORTES:Zona tranquila a penas unos metros de la playa de Vilanova, transporte público de autobuses en todas direcciones a 100 metros, cerca de colegios, supermercados, cines, ambulatorio y hospital, etc.NO DEJE DE VENIR A VISITARLO, LE GUSTARÁ!."" ";"Piso en venta en Barri de Mar - Ribes Roges, Vilanova i la Geltrú";"375000";"111";"3";"Bajo";"1.7235113";"41.217395"
"25";"https://www.idealista.com/inmueble/30354933/";" ""REFERENCIA: MC1221-12GHDISTRIBUCIÓN: (70 m2 + 20 de jardín + 25 de patio de luces interior y terraza comunitaria de 100)- El bajo esta muy bien situado en una zona muy tranquila y muy cerca de todos los servicios a pie, a 500metros de la estación de Renfe.- 3 habitaciones, dos amplias individuales y una muy grande con baño suite.- Salón comedor de 22 m2 con salida al jardín de 20 m2- Cocina independiente con salida a patio de luces interior de 25 m2- 2 baños completos- Recibidor con puerta blindada y alarma.- Dispone de una gran terraza comunitaria en el ultimo piso de unos 100 m2 para tender la ropa y utilizar como solárium.- Plaza de parking para coche grande- El edificio dispone de ascensor de ultima genenración.CALIDADES:- Suelos de gres.- Carpintería exterior de aluminio climalit de doble cristal color gris oscuro.- Carpintería interior de madera de haya.- Calefacción de gas ciudad y agua caliente- Puerta de seguridad.- Alarma instalada en todo el inmueble.ZONA:- La zona es inmejorable por su tranquilidad, estando a quinientos metros del centro de Vendrell. Donde encontrara todo tipo de tiendas y supermercados, Hospital y de la Renfe. A si mismo muy bien comunicado cerca de todas la autovías y autopistas. Tanto para Tarragona como para Barcelona.TRANSPORTE URBANO:- Al lado del inmueble esta la estación del tren, autobuses, taxis y a un paseo de las playas de la Costa Dorada."" ";"Piso en venta en La Muntanyeta - La Franquesa, El Vendrell";"95000";"85";"3";"Bajo";"1.543479";"41.2215033"
"26";"https://www.idealista.com/inmueble/27664525/";" ""CERTIFICADO DE EFICIENCIA ENERGETICA D Espectacular chalet independiente de construcción nueva en el Vedat de Torrent, con una parcela individual de 440 m2 y piscina independiente rodeada de madera de IPE. Consta de 4 plantas. En la 1ª planta dispone de hall, comedor salón, cocina office, habitación individual con armario empotrado y baño completo. En la 2ª planta, 3 habitaciones dobles con armarios empotrados y 2 baños completos. 4ª planta Miramar y terraza con excelentes vistas al mar, por ultimo planta semisótano con lavadero, cuarto de maquinas con deposito de agua, depuradora y descalcificador. En el semisotano tambien se encuentran 1 salones para diferentes usos. La vivienda tiene las siguientes calidades: Carpintería exterior de aluminio de THECNAL con cristales CLIMALIT, suelo de parket laminado roble de la casa GOLVABIA, cuartos de baño completos con mamparas, accesorios y espejos de SANICO, gritería de la casa HANSGROHE y saneamientos de la casa DURAVIT. Armarios empotrados vestidos interiormente en haya y puertas lacadas en blanco de la casa TREKU. Carpintería interior en DM lacada en mismo color de la pared, calefacción central con radiadores de ROCA, instalación por conductos de aire acondicionado frío-calor de MITSUBISHI. Barandillas de cristal, puertas de vehículos automáticas, cocina office de la casa SANTOS. Alarma interior y exterior de FEIX. La piscina dispone de limpia fondos, ducha de acero inoxidable y luz. Tambien dispone de jardin terminado y garaje exterior con cubierta para 2 vehiculos. La vivienda se encuentra en el centro del Vedat con todos los servicios cercanos. Medico, banco, cafetería, peluquería, farmacia, parada de bus. Etc. Vivienda situada en una de las urbanizaciones más consolidadas de la comunidad valenciana. Tiene servicios de colegios concertados como privados, centro de salud, centros comerciales y servicio de transporte público. Todo ello en un paraje natural considerado el pulmón de Valencia. Se encuentra a tan solo 15 minutos del Valencia capital, 20 minutos de la playa y 15 minutos del aeropuerto. Acceso directo a la A-7 y V36."" ";" Casa o chalet independiente en venta en Urb. centro del vedat, Zona El Vedat-Santa Apolonia, Torrent";"550000";"315";"4";"Hipoteca 1.409 eur/mes - ";"-0.4886394";"39.421718"
"27";"https://www.idealista.com/inmueble/2073461/";" ""La primera planta está dividida en salón (19,07 M2, con aire acondicionado y bomba de calor), cocina (7,75 M2), galería cerrada (2,80 M2), dormitorio doble (11,22 M2) y baño (3,52 M2, el baño es de cuatro piezas con bañera y columna de hidromasaje).La segunda planta esta divida en terraza (32,52 M2, con barbacoa de obra), baño (3,35 M2, de tres piezas con ducha cerrada con mampara (aunque en la foto no aparezca) con columna de hidromasaje), dormitorio principal (15 M2, con aire acondicionado y bomba de calor, y armario empotrado a medida) y otro dormitorio (9,57 M2, con aire acondicionado y bomba de calor).Piso exterior y luminoso.Calefacción individual.Portero automático.Suelo de gres.Ventanas de aluminio con cristal climalit.Puertas interiores de haya.Puerta calle con cerradura de seguridad.Pintura en buen estado.Electricidad en buen estado.Tuberías en buen estado.Portal buen estado.Ascensor.Gastos de comunidad: 50 €.Estado del piso seminuevo (8 años).Incluye plaza de garaje, si no la quisiera bajari."" ";"Dúplex en venta en calle Ángel Jaria, 19, Miralbueno - Bombarda, Zaragoza";"135000";"115";"3";"2ª";"-0.9299558";"41.6570757"
"28";"https://www.idealista.com/inmueble/32196316/";" ""¡Coqueto piso! Oportunidad! . Precioso piso, practicamente a estrenar, con dos dormitorios amplios y muy luminosos, ambos poseen grandes ventanales al exterior, cada uno de ellos con sus armarios empotrados forrados y con cajoneras, un baño completo de diseño, cocina de porcelanosa y salón. Además dispone de otro espacioso armario empotrado justo en la entrada a la vivienda, también forrado y con su correspondiente cajonera. La vivienda consta de aire acondicionado centralizado, cierres de climalit, tarima en toda la vivienda a excepción de las zonas húmedas (cocina y baño), paredes lisas y termo eléctrico de 74 litros. Ubicado en muy buena zona, a 10 minutos andando al centro de Málaga, a 200 metros del Hospital Carlos de Haya, escelentes conexiones y rodeado de un gran número de parques infantiles y colegios."" ";"Piso en venta en Carranque - Hazas Nuevas, Málaga";"160000";"65";"2";"4ª";"-4.444708";"36.7193559"
"29";"https://www.idealista.com/inmueble/31854915/";" ""Excelente ático-dúpex en una de las mejores zonas de Castellón, vivienda de lujo con acabados de primeras calidades, en zona Av. Del Mar, superf. útil 183 m², 5 habitaciones ( 1 suite, 3 dobles, 1 individual), 3 baños, cocina de10 m2 + comedor 15 m2, lavadero, salón con chimenea, terraza de 20 m2, balcón de 8 m2, dispone de plaza de garaje en el mismo edificio, suelos gres, ascensor, armarios empotrados, calefacción central, puerta blindada, portero automático, vidrios dobles, año construcción 1993, gastos comunidad 41€/mes, agua, luz, gas, carpintería exterior con doble ventana, carpintería interior haya, totalmente exterior, orientación norte, sur, soleado, alarma. Vivienda de lujo con excelentes vistas. Zona tranquila y próxima al centro de la cuidad, rodeada de todos los servicios necesarios tales como: institutos, colegios, comercios, supermercados, cafeterías y centro de salud parques y zonas verdes. Ven a verla, te encantará."" ";"Dúplex en venta en Zona Av. del Mar, Castellón de la Plana / Castello de la Plana";"279000";"183";"5";"9ª";"-0.0280738";"39.9854963"
"30";"https://www.idealista.com/inmueble/31959713/";" ""Piso de 85 m2. Ámplio comedor de 26 m2 con acceso a TERRAZA. 3 habitaciones dobles con armarios empotrados. Cocina independiente con lavadero. 2 baños completos. Suelos de gres/parquet. Carpintería interior de haya y exterior de aluminio con doble acristalamiento. Completamente exterior y muy soleado. En BUEN estado. Visítelo sin compromiso. Financiación al 100%."" ";"Piso en venta en calle del tigre, 35, Les Casernes - Sant Jordi, Vilanova i la Geltrú";"153300";"85";"3";"3ª";"1.73074";"41.2256"
