"";"URL";"Info";"Direccion";"Precio";"Superficie";"Habitaciones";"Planta";"Longitud";"Latitud"
"1";"https://www.idealista.com/inmueble/31142032/";" ""Precioso piso esquinero, amplio y muy luminoso con vistas al Pinar y al mar desde todas las estancias. 4 habitaciones dobles exteriores (entre 10-12 m2), con armarios empotrados y un vestidor. Baños reformados recientemente. Cocina con espacio para comer cuatro personas (11 m2) y galería con tendedero. Gran salón-comedor (26 m2) con ventanales y acceso a la terraza. Calefacción de gas natural, suelo de mármol, gres (baños) y porcelánico (cocina). Carpintería de haya, doble acristalamiento en ventanas, todas con mosquiteras. Orientación este: salón, habitación principal y habitación 2; orientación norte: cocina; orientación oeste: habitaciones 3 y 4. Comunidad muy tranquila y agradable, 2 vecinos por planta (6 alturas). Muy bien situado en paseo peatonal: playa, Tram, colegio, puerto y zona de ocio, hipermercado y comercios, instalaciones deportivas, centro de salud, piscina municipal, todo 5-10 minutos a pie. Rápido acceso a autovía CS-22. Para entrar a vivir, ideal todo el año.Contacte con nuestra inmobiliaria, un equipo de profesionales altamente capacitado le asesorara en todo lo que necesite."" ";"Piso en venta en sebastián elcano, El Grau de Castelló";"180000";"110";"4";"4ª";"0.013925";"39.9767949"
"2";"https://www.idealista.com/inmueble/30022981/";" ""Playa de Roche - Elegante y lujoso chalet moderno de estilo minimalista. Totalmente amueblado y equipado para entrar a vivir o pasar temporadas cerca del mar. En una de las mejores y más selectas urbanizaciones de la costa de Cádiz, en Calas de Roche. 200 m2, 2 plantas de altura, 2 terrazas, porche, piscina, 4 habitaciones, 1 de ellas suite con vestidor y baño, 3 baños, pvc, puertas de haya. Distancia a la playa 300 metros. E-inmobilia: te asomamos a tus sueños."" ";" Casa o chalet independiente en venta en Roche, Conil de la Frontera";"470000";"200";"4";"Hipoteca 1.205 eur/mes - ";"-6.1426778";"36.3182921"
"3";"https://www.idealista.com/inmueble/30181580/";" ""Se Venden en Palma viviendas de Obra Nueva. Fotografías de ""piso piloto! La compra de plaza de garaje y trastero es de obligado cumplimiento, NO incluido en Precio. Circuito de calefacción-refrigeración por aire, mediante bomba de calor. Armarios Empotrados: puertas lisas en madera de haya, revestidos interiormente con estante y barra. Cocina equipada con armarios a dos niveles, combinados en dos colores, acabados en formica o similar, encimera de silestone, placa vitrocerámica de tres fuegos, torre con horno eléctrico y microondas en acero inoxidable, fregadero de acero inox. dos senos (1 de 40 y el otro de 20), campana extractora de humos extraíble acabado en acero inoxidable. Instalaciones y hueco para lavavajillas. Coladuria. Para T. V. y F. M. de los canales de la red terrestre y parabólica orientada a un satélite, tomas en salón-comedor, cocina y dormitorio principal, previsión en resto de dormitorios. Telefonía exterior: conexión en salón-comedor, cocina y en todos los dormitorios. Cable: previsión de conductos con guías desde registro rellano a recibidor, con acceso al cuarto de telecomunicaciones. Tomas en todas las dependencias excepto servicios. Alarma: preinstalación consistente en registro inicial con tomas de teléfono, corriente y canalización a distintos puntos de la vivienda. Videoportero: comunicación desde el acceso del vestíbulo a la vivienda. Preinstalación Home-Cinema en salón. PRECIO Y DISPONIBILIDAD A CONSULTAR! Plaza España en 15 minutos andando!."" ";"Piso en venta en L'Olivera - Amanecer, Palma de Mallorca";"187000";"88";"3";"3ª";"2.6560432";"39.5895731"
"4";"https://www.idealista.com/inmueble/32612083/";" ""PRECIOSAS E INMEJORABLES VISTAS las que tiene este apartamento de 2 dormitorios en El Cabo de las Huertas. Para pasar el verano o vivir todo el año. La vivienda es un sexto piso con ascensor y plaza de garaje. La vivienda es toda exterior, con un amplio salón con cocina abierta y amplio dormitorio principal con vistas al mar. Desde el salón se accede a una terraza amplia dónde se contempla todo el Cabo y Alicante. La temperatura en la vivienda y la luz son extraordinarias ya que está orientada a Sur. La urbanización consta de piscina, zona de juego para niños y preciosos jardines, así como plaza de parking. La vivienda se haya en una zona muy bien conectada, tiene casi en la misma puerta parada de autobuses y parada del TRAM a 3 minutos. También tiene cerca una playa y varias calitas así como la Playa de San Juan. En la misma calle hay un mercado y centro de salud así como gimnasio público, hoteles y cafeterías. Dispone de dos ascensores nuevos. También está rodeada de pequeñas calas bien para pasear, bañarse o pescar. Es una de las zonas más exclusivas de la costa alicantina y mejor comunicadas por transporte público. Rodeadas de zonas deportivas, colegios, hoteles, restaurantes, etc."" ";"Piso en venta en calle tridente, Cabo de las Huertas, Alicante / Alacant";"115000";"65";"2";"6ª";"-0.4253712";"38.3583255"
"5";"https://www.idealista.com/inmueble/1593913/";" ""La dirección exacta es Calle Coruña, 10. La ventana de localización de idealista no se corresponde con la dirección real. Apartamento con rentabilidad del 7,5%. Inquilinos temporales que representa una base de ingresos demostrables haciendo atractiva la inversion desde el momento de compra. Exterior dormitorio y salón, . Suelos en tarima de haya, como así mismo las puertas, ventanas con puente térmico doble cristal y oscilobatientes, cocina totalmente equipada en acero. Plaza de garaje, trastero de 15m3. impresionante situación céntrico, a 150 metros del puerto y a excasos metros de grandes supermecados, bancos, ect. distribución: terraza descubierta de 3 m2 3 vecinos en el edificio."" ";"Piso en venta en calle Coruña, 14, A Guarda";"64900";"48";"1";"1ª";"-8.8737137";"41.899575"
"6";"https://www.idealista.com/inmueble/32313943/";" ""REFERENCIA: MCC-023-LTPrecioso piso a 70 metros de la playa de las Dunas de Torredembarra, considerada una de las mejores playas certificado por la U. E.DISTRIBUCIÓN: - 2 habitaciones.- 2 baños completos.- Cocina amplia e independiente totalmente equipada.- Salón comedor con salida a terraza con vistas al mar.- Ascensor.- Plaza de garaje.- Zona infantil comunitaria.- Piscina comunitaria.CALIDADES:- Suelos de mármol.- Carpintería interior de haya.- Carpintería exterior de aluminio climalit de doble cristal.- Armarios empotrados.- Calefacción.- Aire Acondicionado.ZONA:- Torredembarra, zona las Amforas.- A 70 metros de la playa.- Zona muy tranquila.- Muy bien situado cerca de todos los servicios.TRANSPORTE PUBLICO:- A pocos minutos de la estación de Renfe.- Muy cerca de la autopista.- Cercano a diferentes paradas de autobus.- A 5 minutos del centro de Torredembarra y a 3 minutos de Creixell.OPCIONES: Subrogación de hipoteca y posibilidades de alquiler.¡ Gran piso en una zona inmejorable! ¡ Llámenos y no deje pasar la oportunidad de visitarlo!."" ";"Piso en venta en Clarà, Torredembarra";"202235";"100";"2";"1ª";"1.4276334";"41.1525143"
"7";"https://www.idealista.com/inmueble/31952491/";" ""Precioso piso en urbanización cerrada con piscina, pista de paddle y zona de juegos ideal para niños. Cuenta con comedor-salon, cocina completa equipada con todos los electrodomésticos, 2 habitaciones con armarios empotrados revestidos por dentro, 2 baños de marmol completos y equipados con todos sus accesorios, aire/calefacción, puertas de madera de haya, balcon, suelos parquet, 3 armarios revestidos. Mucha luz. Incluye plaza de garaje y trastero. Mejor ver."" ";"Piso en venta en Babel, Alicante / Alacant";"175000";"85";"2";"4ª";"-0.50151";"38.33977"
"8";"https://www.idealista.com/inmueble/32742316/";" ""La urbanización está situada en Cala Gració, en la bahía de San Antonio, una zona tranquila en primera línea de mar y con las mejores vistas a las puestas de sol. Laurbanización se compone de viviendas de 2 y 3 dormitorios, con excelentes calidades, entre las que cabe destacar: carpintería exterior de aluminio anodizado, persianas enrollables monoblock antirrobo en las plantas bajas, doble acristalamiento, puerta de entrada blindada, carpintería interior en haya vaporizada, sanitarios de porcelana vitificada de primera marca, preinstalación de domótica, instalación de aire acondicionado y cocinas equipadas con muebles, encimera de silestone, horno eléctrico, placa vitrocerámica y campana extractora.El edificio cuenta con jardines abancalados, piscina comunitaria, ascensores con paradas en todas las viviendas adaptados para minusválidos y trasteros y garajes opcionales. Hay planos y más fotos disponibles.Viviendas disponibles y precios:ENGLISH:The development is located in Cala Gracio, in the bay of San Antonio, a quiet area in front of the sea with the best views of the sunsets. The complex consists of 3-4 bedrooms apartments with excellent qualities, among which are include: anodized aluminum exterior carpentry, monoblock blinds burglar on the lower floors, double glazing, armored door, interior carpentry beech, porcelain sanitary vitificada top brand home automation preinstallation, installation of air conditioning and furnished kitchens, silestone worktop, electric oven, hob and extractor.The building has terraced gardens, swimming pool, elevators stopping at all adapted for disabled, storage and optional garages."" ";"Piso en venta en Sant Antoni de Portmany";"440000";"147";"3";"1ª";"1.2963426";"38.989568"
"9";"https://www.idealista.com/inmueble/32742318/";" ""La urbanización está situada en Cala Gració, en la bahía de San Antonio, una zona tranquila en primera línea de mar y con las mejores vistas a las puestas de sol. Laurbanización se compone de viviendas de 2 y 3 dormitorios, con excelentes calidades, entre las que cabe destacar: carpintería exterior de aluminio anodizado, persianas enrollables monoblock antirrobo en las plantas bajas, doble acristalamiento, puerta de entrada blindada, carpintería interior en haya vaporizada, sanitarios de porcelana vitificada de primera marca, preinstalación de domótica, instalación de aire acondicionado y cocinas equipadas con muebles, encimera de silestone, horno eléctrico, placa vitrocerámica y campana extractora.El edificio cuenta con jardines abancalados, piscina comunitaria, ascensores con paradas en todas las viviendas adaptados para minusválidos y trasteros y garajes opcionales. Hay planos y más fotos disponibles.Viviendas disponibles y precios:ENGLISH:The development is located in Cala Gracio, in the bay of San Antonio, a quiet area in front of the sea with the best views of the sunsets. The complex consists of 3-4 bedrooms apartments with excellent qualities, among which are include: anodized aluminum exterior carpentry, monoblock blinds burglar on the lower floors, double glazing, armored door, interior carpentry beech, porcelain sanitary vitificada top brand home automation preinstallation, installation of air conditioning and furnished kitchens, silestone worktop, electric oven, hob and extractor.The building has terraced gardens, swimming pool, elevators stopping at all adapted for disabled, storage and optional garages."" ";"Piso en venta en Sant Antoni de Portmany";"475000";"147";"3";"Bajo";"1.2961178";"38.9875851"
"10";"https://www.idealista.com/inmueble/30857805/";" ""Casa rústica de piedra con terreno, carácter y encanto en plena Serra de Tramuntana. Se haya construida en un terreno de 10.000m2, rodeada de encinas y olivos. dispone de excelentes vistas a la montaña y al pueblo de Galilea. Se distribuye en 3 habitaciones, 2 baños, salón comedor con chimenea, cocina con chimenea, horno de leña y porche. Techos altos y vigas vistas."" ";" Finca rústica en venta en Urb. conques, Puigpunyent";"480000";"120";"3";"Hipoteca 1.231 eur/mes - ";"2.515073";"39.608672"
"11";"https://www.idealista.com/inmueble/29246278/";" ""Ref 05062, apartamento de construccion nueva del 2006. Vivienda con garaje y trastero, edificio con complejo, piscina, paddle, club social, la vivienda consta de 85m, dos habitaciones, 2 baños completos uno en suite, armarios empotrados, vestidos, suelo de gres, puertas de haya, ventanas de aluminio climalit, cocina independiente, comedor con terraza de 8 m cubierta, la vivienda esta para entrar, es muy luminosa, funcional, no tiene pasillo y en un punto estrategico a pasos de la playa y en centro mas comercial, no duden en visitarlo, este anuncio no es vinculante, puede contener errores, se muestra a titulo informativo y no contractual."" ";"Piso en venta en Playa de Farnals";"140000";"97";"2";"2ª";"-0.29157";"39.56095"
"12";"https://www.idealista.com/inmueble/302511/";" ""Directo de Propiedad. Abstenerse inmobiliarias. apartamento a estrenar en Urbanizacion Marcolina con increibles vistas de Alcocebre y del mar. Zona tranquila. Piscina, garaje, zona comunitaria, parque infantil. Dada la caducidad del Certificado Energético, este se sacara en el momento que haya un interesado en firme. En una semana se obtiene."" ";"Piso en venta en calle Marcolina s/n, Alcossebre";"85000";"75";"2";"1ª";"0.2706833";"40.2408658"
"13";"https://www.idealista.com/inmueble/32059329/";" ""PRECIOSO PISO CON 3 DORMITORIOS, 1 BAÑO, AMUEBLADO, BALCÓN, COCINA INDEPENDIENTE, CALEFACCIÓN CON BOMBA CALOR Y FRIO, ASCENSOR, SITUADO EN UNA ZONA TRANQUILA. MUY BIEN DE PRECIO, ASCENSOR, BOMBA DE CALOR Y FRÍO, PUERTA DE ENTRADA DE SEGURIDAD, PUERTAS DE HAYA, VENTANAS DE ALUMINIO CLIMALIT, SUELOS DE GRES, TERRAZA DE 14M2, COCINA EQUIPADA. BUENA INVERSIÓN............................."" ";"Piso en venta en joan miro, L'Ampolla";"116000";"85";"3";"1ª";"0.7096359";"40.8121752"
"14";"https://www.idealista.com/inmueble/32070441/";" ""Muy buen piso en venta, totalmente reformado, incluida electricidad y fontanería. Tiene 3 dormitorios, 1 de ellos doble, dos cuartos de baño completos, cocina amueblada y con electrodomésticos, terraza con buenas vistas. El suelo es de tarima y la carpinteria interior es de haya. Tiene aire acondicionado y cristales Climalit. El portal está reformado también. Tiene la posibilidad de comprar una plaza de garaje en el mismo edificio."" ";"Piso en venta en Carolinas Altas, Alicante / Alacant";"95000";"98";"3";"4ª";"-0.4774164";"38.3588962"
"15";"https://www.idealista.com/inmueble/1712434/";" ""Abstenerse inmobiliarias. Directo del propietario. apartamento en primera linea de playa en el paseo de Las Fuentes (una de las mejores zonas de Alcocebre), terraza con vistas al paseo y al mar, zona tranquila de alcocebre. Contacto solo por correo electrónico. Dada la caducidad del Certificado Energético, este se sacara en el momento que haya un interesado en firme. En una semana se obtiene."" ";"Piso en venta en paseo de las Fuentes, 218, Alcossebre";"140000";"58";"1";"1ª";"0.2706833";"40.2408658"
"16";"https://www.idealista.com/inmueble/31887641/";" ""Inmobiliaria Oficial.El inmueble (PISO) se encuentra situado en el municipio de Vinyols i els Arcs (TARRAGONA). La vivienda está ubicada en un edificio de tres alturas. Precio: 47.234 euros (antes 61.200 euros). Descuento: -23%."" ";"Estudio en venta en Vinyols i els Arcs";"47234";"46";NA;"2ª";"1.0403887";"41.116656"
"17";"https://www.idealista.com/inmueble/1955240/";" ""Delante un jardin de 5000 m2, no es necesario aire acondicionado en verano es fresquito, ventanales grandes en toda la casa, cocina, puertas y armarios de haya, los armarios estan forrados, para entrar a vivir. distribución: 3 vecinos en el edificio la casa dispone de: portero automático."" ";"Piso en venta en calle Santa Berta, 2, Zona Llombai, Burriana";"1e+05";"90";"3";"2ª";"-0.0897648";"39.8852721"
"18";"https://www.idealista.com/inmueble/1955240/";" ""Delante un jardin de 5000 m2, no es necesario aire acondicionado en verano es fresquito, ventanales grandes en toda la casa, cocina, puertas y armarios de haya, los armarios estan forrados, para entrar a vivir. distribución: 3 vecinos en el edificio la casa dispone de: portero automático."" ";"Piso en venta en calle Santa Berta, 2, Zona Llombai, Burriana";"1e+05";"90";"3";"2ª";"-0.0897648";"39.8852721"
"19";"https://www.idealista.com/inmueble/26936330/";" ""Duplex a la orilla del mar en la playa del puerto de sagunto, sin duda la mejor playa de la Comunidad Valenciana. La vivienda esta rodeada de zonas verdes, el paseo maritimo, pistas de tennis, restaurantes, hornos, comercios, parques para los niños, aparcamiento...etc. en la mejor playa de la Comunidad Valenciana, con varios premios anuales, una arena unica y un mar limpio como ninguna.La vivienda es una planta baja-primer piso, es un duplex, por ello carece de ascensor, solo un vecino en el duplex de arriba, sin gastos de comunidad, ideal para vivienda de vacacione so alquilar. Estas viviendas se suelen alquilar poe 900€ el mes de junio. 1300€ en el mes de julio y entre 1500 y 1700 agosto. Eso en crisis, en años posteriores se ha llegado a pagar hasta 2500€ por una vivienda de estas caracteristicas tan cerquita de la playa.Detalles de la vivienda duplex: consta de 2 habitaciones una de ellas con vestidor y la otra con armario empotrado y terraza. Un baño. Todo ello en la 1º Planta.En la planta baja: cocina oficce, salita, aseo y terraza de 10 m2.En el sotano: salon amplio de unos 40m2, una habitacion y bodega.Es una calle tranquila, obra nueva, amueblada y decorada. Todo de diseño y a medida.Suelos porcelacos, bancadas de silestone, capienteria metalica imitacion madera, puertas macizas en haya vaporizada, video portero, todo ello y mas a un paso de la mar."" ";"Dúplex en venta en calle de Hernán Cortés, 25, Playa Puerto de Sagunto, Puerto de Sagunto";"121000";"160";"3";"Bajo";"-0.2132037";"39.6606868"
"20";"https://www.idealista.com/inmueble/1906314/";" ""Vivienda con acabados de muy buena calidad y diseño moderno: pavimento de la vivienda de Gres porcelánico de 47x47 cms. El mismo material combinado en dos tonalidades en los alicatados de los baños. Pavimento de terrazas, escaleras y solarium de gres porcelánico antideslizante de 33x33 cms. Carpintería exterior de aluminio anodizado de color ceniza y acristalamiento doble. Carpintería interior de madera de haya. Inodoros y bidet suspendidos. muebles de baño color wengue. Iluminación con foquitos. distribución: terraza descubierta de 62 m2 la casa dispone de: portero automático."" ";" Chalet pareado en venta en avenida Central, 68, El Toro, Calvià";"375000";"150";"3";"Hipoteca 961 eur/mes - ";"2.4817893";"39.4853226"
"21";"https://www.idealista.com/inmueble/1622100/";" ""Piso de 3 dormitorios nuevo, en residencial de lujo, muy luminoso, en esquina, a 300 m del mar, entre auditorium y aquarium de roquetas,próximo a centro comercial y colegios. Calidades de primerísima calidad, (pocelanosa en baños y suelo porcelana rectificado, grifería grhoe, carpintería exterior climalit, puertas y 4 armarios empotrados en madera haya), cocina, 3 dorm, 2 baños completos, salón, amplia terraza, lavadero cerrado, y plaza de garaje.2 piscinas, parque infantil y zonas verdes. Excelente ambiente y zona tranquila."" ";"Piso en venta en avenida Reino de España, 123, Las Salinas, Roquetas de Mar";"180000";"110";"3";"2ª";"-2.607169";"36.777486"
"22";"https://www.idealista.com/inmueble/30294003/";" ""Masia de lujo. Maravillosa propiedad situada en la mejor zona del interior del Empordà, y al mismo tiempo, muy cerca de la preciosa Costa Brava. Situada en una parcela de 9.000 metros cuadrados, donde se haya enclavado este fabuloso chalet de nueva construcción de 500 metros cuadrados de superficie, dotado de acabados de primerísima calidad, actuales y modernos.En la planta baja encontramos un acogedor hall/ distribuidor que nos dirige al gran salón-sala de estar orientado con salida directa a la terraza/jardín, una preciosa Master suite con vestidor y baño con ducha de hidromasaje y jacuzzi con altillo-despacho incorporado, un elegante comedor independiente y una gran cocina oficce totalmente equipada y con acceso directo a la terraza/jardín y a la zona de piscina y barbacoa. En la misma planta baja, encontramos una estancia en la acutalidad reservada como habitación para el servicio que consta de dormitorio con baño completo. Tenemos también las dos habitaciones suites para invitados con sus respectivos altillos y con salida directa a la terraza/jardin. Ideales para descansar y tener paz y relax. Sencillamente única y especial.En su exterior, maravilloso y gran jardín con vistas a la naturaleza, al Alt Empordà, gran piscina, porche cubierto, zona barbacoa, y sistema de riego automático entre otras cosas. Toda la casa se encuentra equipada con calefacción central así como de aire acondicionado, alarma exterior e interior, y un alto grado de seguridad, techos de madera natural y suelos de color gris, materiales de gran calidad y una gran luminosidad en todo el chalet.Por su distribución se caracteriza por ser una preciosa finca, con una calidez exquisita y una fantástica funcionalidad, que permite disfrutar de todas sus estancias.Genial para disfrutar cada día del año!#ésfàcil. SAUS-CAMALLERA-LLAMPAIES = SR. BONAL. Nº1 en VENTA y ALQUILER de fincas rústicas en el Empordà, en Girona y en la Costa Brava. ¿A qué esperas? ¡Vívelo!"" ";" Masía en venta en Saus";"1600000";"500";"4";"Hipoteca 4.101 eur/mes - ";"2.9762798";"42.1293178"
"23";"https://www.idealista.com/inmueble/28172715/";" ""Masía , casa pairal y anexos perfectamente integrados en su entorno, en uno de los enclaves más idílicos del Empordà, donde se haya ubicada esta maravilla arquitectónica. Goza de los más elegantes detalles en su restauración, donde se han utilizado los mejores materiales, preservando la edificación original, siguiendo una estética exquisita que le confiere un carácter armonioso en sus distintas estancias y salas.La luz natural recorre sus salones, habitaciones y estancias ofreciendo el esplendor de las paredes de piedra y la magnificencia de los techos, en algunos casos abovedados y en otras con espectaculares vigas de madera.La planta baja se distribuye mediante un recibidor, baño con ducha, sala de estar, comedor y cocina reuniendo en si la zona de día. En la primera planta los dormitorios suite, una sala de billar, biblioteca y acceso a una terraza.Las construcciones anexas proporcionan espacios ideales para la celebración de eventos o reuniones familiares, así como para el almacenamiento de utillaje de jardinería y/o mantenimiento. La zona de piscina totalmente integrada en la edificación, queda imperceptible y proporciona un alto grado de intimidad.Toda la propiedad, mayoritariamente de prados de cultivo, se encuentra situada en el término municipal de referencia, con unas soberbias vistas de su entorno natural.#ésfàcil. CAPMANY = SR. BONAL. Nº1 en VENTA y ALQUILER de fincas rústicas en el Empordà, en Girona y en la Costa Brava. A qué esperas? Vívelo!"" ";" Masía en venta en Capmany";"1080000";"740";"4";"Hipoteca 2.768 eur/mes - ";"2.9229289";"42.370254"
"24";"https://www.idealista.com/inmueble/2028726/";" ""Espectacular piso en Can Farrerons de 105m2, 4 habitaciones, (2 dobles con armario empotrado) comedor de 25m2 con salida a terraza de 7m2, todo exterior y muy luminoso, Orientado a mar, baño completo con bañera redonda hidromasaje y columna de hidromasaje, gran recibidor, galería, a/a, calefaccion, parquet, puertas de haya y carpinteria de aluminio, todo reformado, 4ª De altura con ascensor y pk para coche grande. Fachada reformada, ascensor nuevo y puerta entrada al edificio nueva. muy buena ubicacion, cerca de transportes publicos, colegios, restaurantes, comercios y playa."" ";"Piso en venta en calle Doctor Batista y Roca, 3, Premiá de Mar";"280000";"105";"4";"4ª";"2.3576067";"41.4879919"
"25";"https://www.idealista.com/inmueble/28852640/";" ""¡Pisos a estrenar!En Colera, municipio costero perteneciente a la Costa Brava y que dispone de buenas comunicaciones. Ubicado en un entorno natural y con excelentes playas.Piso luminoso de 105 m² y con buenas calidades, de 3 dormitorios y 2 baños. Dispone de suelos de gres de calidad en toda la vivienda, carpintería exterior de aluminio lacada en color granate, carpintería interior de madera de haya, cocina amueblada y equipada con vitrocerámica y horno.Precio: Desde 92.000 €¡Contacta con nosotros hoy mismo!"" ";"Piso en venta en calle del Mar, 80, Colera";"92000";"105";"3";"2ª";"3.1500359";"42.4034557"
"26";"https://www.idealista.com/inmueble/431365/";" ""Apartamento de 36 m2 + Terraza esquinera de 22 m2. Cocina independiente, con encimera de cuarzo azul Silestone y techo de aluminio blanco. 1 habitación (doble) + vestidor. Suelo de tarima flotante (laminado AC3-haya) y puerta de la entrada de haya maciza. Carpintería exterior nueva de aluminio y cristales climalit de doble cámara (¡pendiente actualizar fotos! ). Instalación eléctrica totalmente revisada. Amueblado o no, a convenir. Edificio rehabilitado. Zona tranquila rodeada de vegetación, con vistas mar y montaña. Ventajas comunitarias como piscina, espacio ajardinado y zona de aparcamiento en el exterior. Parada de autobús en la entrada de la zona. (En VENTA directa o con posibilidad de ALQUILER CON OPCIÓN A COMPRA: 6.000 € de arras al entrar + 500 €/mes hasta la fecha efectiva de compra-venta en el plazo máximo de 2 años. )."" ";"Piso en venta en calle Sa Gabarra, 35, Tossa de Mar";"98000";"60";"1";"1ª";"2.9231017";"41.7259593"
