"";"URL";"Info";"Direccion";"Precio";"Superficie";"Habitaciones";"Planta";"Longitud";"Latitud"
"26";"https://www.idealista.com/inmueble/31891220/";" ""Vivienda totalmente reformada de 84m2 útiles distribuidos en 3 habitaciones, 1 baño, amplio salón comedor, exterior muy luminoso en 3ª planta con ascensor, suelos de tarima, ventanas de climalit, puertas de haya, armarios empotrados, 2 Aire Acondicionados, gas natural. IMPECABLE PARA ENTRAR A VIVIR!."" ";"Piso en venta en orden del cister, 3, Soternes, València";"99500";"90";"3";"3ª";"-0.4078948";"39.470637"
"27";"https://www.idealista.com/inmueble/32736403/";" ""BONITO PISO TODO EXTERIOR DE 118 m2 con cuatro dormitorios todos con armarios empotrados ( dos dobles), salón - comedor de 30 m2 con salida a balcón orientado a mar, cocina equipada office con muebles lacados y salida a lavadero, dos baños completos uno con bañera y el otro con plato de ducha. Calefacción eléctrica , aire acondicionado, puertas de haya oscuras. Finca con ascensor. Párquing incluido en el precio y en la misma finca. Orientación mar y montaña. Cerca de centro comercial y metro."" ";"Piso en venta en Montigalà -Sant Crist, Badalona";"255000";"120";"4";"3ª";"2.2212059";"41.4552486"
"28";"https://www.idealista.com/inmueble/32573153/";" ""Piso totalmente reformado (en el año 2013) junto al Parque de “La Paz”. Visita este piso de 74 m2 con salón, 3 habitaciones, cocina y un baño. Suelos de tarima flotante, ventanas de climalit, puertas de madera de haya vaporizada, cocina y baño reformados íntegramente, calefacción de gas natural individual, instalación eléctrica y de fontanería nuevas. Ascensor. El tejado y el portal del edificio han sido también reformados. Fácil aparcamiento en calle. Disfruta con tus hijos de la zona de columpios del parque o camina y relájate al aire libre en uno de sus numerosos bancos. La compra la tienes a escasos metros en un supermercado muy conocido; frente a un colegio. Solicite información en el teléfono 615355496. Juan Fernández."" ";"Piso en venta en calle hornija, 12, Delicias, Valladolid";"57000";"74";"3";"1ª";"-4.7246515";"41.6338314"
"29";"https://www.idealista.com/inmueble/32548415/";" ""Estupendo y totalmente exterior y reformadola vivienda consta de tres habitaciones, vestibulo - recibidorcuarto de baño completo con bañera salon - comedor, cocina con galeriatiene el suelo de parquert y gres puertas de haya, ventanas de lumino lacado en blanco y con climalit, paredes lisas, la reforma es complenta, fontaneria, electricidad la zona esta muy bien comunicada y con todo tipo de servicioscolegios, supemercados, centro de saludtranvia ( en diez minutos en la playa ) carril - biciy lo mejor a cinco minutos del cauce del rio y diez minutos del centro de la ciudad un buen piso en muy buena zona listo para entrar a vivir."" ";"Piso en venta en Sant Antoni, València";"134000";"100";"3";"2ª";"-0.3734437";"39.4868947"
"30";"https://www.idealista.com/inmueble/30197235/";" ""Nuestra España es un país con una gran diversidad, se compone de diecisiete comunidades autónomas, en ella se hablan cuatro idiomas y es poseedora de gran variedad de paisajes y atmósferas, sería complicado pensar que no podríamos encontrar en ella un lugar que se adapte a cada exigencia.Es por eso que te presentamos un producto que por ubicación y calidad se podría tachar de vivienda exclusiva en mayúsculas.Esta fantástica villa de lujo se sitúa en la Barrosa, a escasos metros de la playa en Chiclana de la Frontera, playa paradisíaca donde las haya de arena fina y blanca y aguas cristalinas. Se encuentra edificada en una parcela de 900 metros cuadrados, y está desarrollada en tres plantas. En la planta principal dispone de suite con baño completo y climatización independiente, cocina de última generación totalmente equipada, dos salones, uno de verano con acceso al jardín y la piscina, y otro de invierno con chimenea. Cuenta además con baño y aseo completo de uso común en la misma.La planta superior de 200 metros cuadrados, cuenta con un amplio distribuidor con una espectacular claraboya que ofrece luz natural a todo el espacio. En esta planta nos encontramos con seis amplias suites, todas con baños de uso privado y climatización independiente. Tiene, además, un salón de lectura o sala de juegos y dos terrazas solarium privadas.La planta semi-sótano tiene 470 metros cuadrados con ventanas exteriores y de doble acceso, rampa para automóviles y escalera con acceso al distribuidor principal.La zona exterior dispone de piscina de cloración salina, amplio porche cubierto de madera y zona de barbacoa. Las calidades de esta impresionante mansión no podrían ser, sino, de la más alta gama como por ejemplo los suelos de mármol de primerísima calidad en toda la vivienda, suelos de gres antideslizante en la zona exterior, ventanas de aluminio lacado en color madera con doble acristalamiento, vidrieras interiores artesanales y un largo etc.La villa se ofrece, además, totalmente amueblada.Puede comprobar esta descripción en el reportaje fotográfico que se incluye en este anuncio, pero si realmente quiere sentir en primera persona todo lo que esta morada puede ofrecerle no pierda ni un segundo y acérquese a vivirlo en primera persona y déjese cautivar por esta espectacular finca.Pídanos más información sin ningún tipo de compromiso y recuerde, acérquese a nosotros y si no le es posible contáctenos y hare."" ";" Casa o chalet independiente en venta en Ctra de La Playa - La Coquina, Chiclana de la Frontera";"1e+06";"870";"7";"Hipoteca 2.564 eur/mes - ";"-6.1692346";"36.4019526"
