"";"URL";"Info";"Direccion";"Precio";"Superficie";"Habitaciones";"Planta";"Longitud";"Latitud"
"1";"https://www.idealista.com/inmueble/27198551/";" ""Vivienda en planta 2ª, plaza de garaje y trastero. Se distribuye en 2 dormitorios, 2 baños, salón, cocina y lavadero. Dispone de pre-instalación de aire acondicionado, instalación de gas ciudad, caldera de gas para el agua caliente y la calefacción por medio de radiadores. Las características de los acabados son suelo de gres porcelánico, pintura lisa, puertas de madera en haya vaporizada, armarios en cada habitación forrados, ventanas motorizadas. Tanto fachada como grifería, sanitarios, alicatados y suelos son de Porcelanosa. Certificado Energético D."" ";"Piso en venta en avenida Miguel Ángel Blanco, 28, Ronda Sur, Murcia";"106000";"80";"2";"2ª";"-1.1271218";"37.9707377"
"2";"https://www.idealista.com/inmueble/27246509/";" ""La ubicación de este local no puede ser mejor. Se haya en un lugar tranquilo, con paso de vehículos muy escaso. A puertas de una gran escuela. No necesita ningún tipo de reforma; su suelo es de gres, las puertas (4) mecánicas tienen acceso con mando a distancia. También dispone de dos espacios; un aseo y uno para una cocina o para una despensa, almacén, despacho, etc. Es muy importante remarcar que fácilmente puede instalarse una salida de humos por si sus futuros dueños desean instalar un negocio de hostelería. Aunque quizá lo mejor de este local no sea su buen estado de forma o su inmejorable ubicación, sino su gran terraza; del mismo tamaño que el local. Una terraza que está perfectamente protegida con rejas metálicas y un acceso exclusivo por su propio vado municipal. Imaginamos una terraza con mesas dispuestas para veladas íntimas en las apacibles noches mediterráneas o meriendas familiares a sabiendas de que los pequeños están protegidos. Mencionar que, además de la terraza, el local dispone de un espacio en su parte delantera que también es útil para la disposición de mesas; siempre en el caso de que su último fin sea el de un negocio hostelero, pero aquí cabe llamar a la imaginación y creemos que es viable para cualquier tipo de emprendeduría."" ";"Piso en venta en calle Bailén, 27, Sant Joan - L'Aiguacuit, Vilanova i la Geltrú";"140000";"146";"1";"3ª";"1.7147813";"41.2244525"
"3";"https://www.idealista.com/inmueble/25725049/";" ""Precioso piso en el centro de La Felguera amueblado y equipado, con grandes ventanales que ocupan practicamente toda la pared sur. Los materiales y la distribución fueron cambiados en obra. en el hall hay un armarioempotrado de madera color wengué con cristales al acido, a la izquierda se abre un gran salón comedor con dos grandes muebles en madera wengué-haya comedor con mesa extensible y 4 sillas, sofá de tres plazas con tela antimanchas muy mullido y sofá monoplaza relax a juego, persiana interior motorizada para el ventanal que ocupa toda la pared. cocina a capricho con un gran servicio, muebles altos y bajos en madera cerezo, platero suelo-techo aprovechando hueco de columna; el esquinero bajo es completamente extraible y el alto tiene persiana de aluminio enrollable. habitación matrimonial con aseo y vestidor de 4m(percheros, zapateros, cajoneras). Baño principal con amplia ducha de pared a pared y encimera de lavabo de bello cristal repujado transparente de gran grosor, radiadores secatoallas en ambos baños. habitación juvenil con gran armario al techo."" ";"Piso en venta en calle Eustaquio Lecue, 1, La Felguera, Langreo";"110000";"70";"2";"1ª";"-5.6926759";"43.3060264"
"4";"https://www.idealista.com/inmueble/32733216/";" ""Saliendo de la cocina hay un patio interior cerrado con un mueble de mampostería en el cual se puede utilizar para la lavadora, tiene toma de agua y desagüe y tuberías para calentador de gas, también se utiliza para guardar enseres. Los ventanales exteriores son climalix espejados el exterior y con apertura oscilo-batientes, las puertas de paso es de haya y la soleria es de gres cerámico color beige, bañera de fibra de poliester aergonomica y lavabo de cristal."" ";"Piso en venta en calle amargura, 15, Plaza de toros - Venta Vargas - Capitania, San Fernando";"93500";"76";"2";"1ª";"-6.1935504";"36.4655835"
"5";"https://www.idealista.com/inmueble/32687745/";" ""Superf. 75 m², 2 habitaciones ( 1 suite, 1 individual), 2 baños, cocina (OFFICE EXTERIOR), comedor (22 M2), suelos PARQUET HAYA VAPORIZADAY GRES, jardín, ascensor, armarios, calefacción, puerta blindada, año construcción 2002, gastos comunidad, agua, luz, gas, carpintería exterior, carpintería interior HAYA VAPORIZADA, exterior, soleado, piscina, Estado certificación:."" ";"Piso en venta en Escodines, Manresa";"110000";"75";"2";"1ª";"1.83664";"41.72391"
"6";"https://www.idealista.com/inmueble/30199277/";" ""Urbanización totalmente vallada cerrada, 6 puertas de acceso a la urbanización, jardines, piscina comunitarios.Vivienda de 122 m2 totalmente reformada, Puerta principal blindada, suelo rústico con opción a mármol blanco Macael, puertas de madera de haya macizas de 1ª calidad, Cocina completamente reformada, 3 dormitorios, 2 baños, dormitorio principal con baño con plato ducha y vestidor muy amplios, armarios empotrados forrados de madera, dormitorio segundario muy amplio, tercer dormitorio pequeño para una cama con armario, u para usar como oficina, salón comedor muy amplio. Dispone de una terraza 18 m2 aproximadamente, orientación sur oeste, le da el sol desde la 13: 00 pm hasta que anochece, toda la vivienda esta protegida con rejas blancas de acordeón. aire acondicionado frio/caliente en dormitorio principal y salon,Dispone de gas natural, termo de gas para el agua de ducha y agua de la cocina.Posibilidad de compra de trastero y plaza de garaje. no incluidos en el precio.Precio de la comunidad 210 € se paga cada trimestre.IBI ANUAL 778'83 €BASURA SEMESTRAL 90'24 €Precio de venta 260. 000 € sin comisión, venta directa."" ";"Piso en venta en calle las Adelfas, 4, Nueva Andalucía, Marbella";"260000";"122";"3";"1ª";"-4.9610874";"36.4926941"
"7";"https://www.idealista.com/inmueble/30728142/";" ""PISO EN VENTA EN FINCA DE SÓLO 3 VECINOS EN ZONA CAN FATJÓ DE RUBÍ, de 144m y compuesto de 4 habitaciones exteriores (3 dobles y 1 individual), 3 armarios empotrados, salón-comedor 32m con chimenea y salida a patio 10m, cocina 16m reformada con salida a patio de 60m, 2 baños completos (1 en suitte de 8m), ventanas de aluminio, puertas de haya, suelo de terrazo, gas ciudad, calefacción, exterior, sol todo el día, finca año 1.999, en muy buen estado.Próximo a: comercios, autobuses, parques, colegios"" ";"Piso en venta en Can Alzamora - Les Torres - Can Fatjó, Rubí";"220000";"144";"4";"1ª";"2.0223033";"41.4903284"
"8";"https://www.idealista.com/inmueble/31313710/";" ""Se vende magnífico piso en la zona de Madre de Dios, 110m2, distribuido en hall de entrada, tres dormitorios muy amplios, dos baños completos uno de ellos en suite, cocina amueblada grande con zona comedor, lavadero, salón-comedor con salida a terraza, orientación sur, muy buenas calidades, suelos de parquet, cinco armarios empotrados vestidos, puertas de madera haya, ventanas tipo climalit, garaje muy amplio y trastero. Piso de estreno!."" ";"Piso en venta en Madre de Dios, Jerez de la Frontera";"186000";"110";"3";"2ª";"-6.133277";"36.6794269"
"9";"https://www.idealista.com/inmueble/31358258/";" ""Se vende dúplex en Molinos Marfagones. Tiene 4 dormitorios ( 1 abajo ), 2 baños, jardín de 25m2, patio de 20m2, sótano de 70m2 y terraza en planta alta. Carpintería interior de puerta lisas en haya vaporizada con mandos en acero, carpintería exterior de aluminio blanco climalit, tarima flotante color haya en toda la casa, focos en toda la vivienda, preinstalación de A/A con splits en todas las habitaciones con 4 aparatos instalados, descalcificador y osmosis inversa instalados, paredes interiores en gotelé fino en color, escalera interior en haya y acero, rejas en toda la vivienda, suelo del sótano en gres imitación madera e instalación de aire acondicionado. Calle privada y orientación mediodía. Año construcción 2006."" ";" Chalet adosado en venta en avenida a los dolores, 30, La Magdalena, Cartagena";"155000";"190";"4";"Hipoteca 397 eur/mes - ";"-1.03878";"37.629"
"10";"https://www.idealista.com/inmueble/31187335/";" ""DUPLEX EN URBANIZACIÓN MIRADOR DE AGRIDULCE I. Detrás de los Aptos Campus (Campus de Espinardo (Murcia) C/ Rosalía de Castro).1ºpiso: 4 Dormitorios con armarios empotrados vestidos, uno de ellos con balcón. El dormitorio principal tiene el baño incorporado con bañera y encimera de mármol con lavabo encastrado. El otro baño con ducha. Bajo: Amplio SalónComedor 28 mts. Aseo. Cocina con espacio para comer y electrodomésticos. Habitación de lavado y plancha. Suelo de mármol beige. Pintura gotelé blanca. Carpintería interior de haya vaporizadan. Carpinteria exterior de aluminio blanco con persianas. Gas ciudad. Sótano: Trástero y 2 Plazas Garaje.Porche de entrada. Detrás saliendo del salón gran terraza de 30 mts. Frente a zona ajardinada que da acceso a la piscina comunitaria.Ventilador de techo en todas las habitaciones.Supermercado grande al lado.Tranvía a 200 mts. Playa a unos 50 kilometros."" ";"Dúplex en venta en calle rosalía de castro, 75, Guadalupe, Murcia";"245000";"250";"4";"1ª";"-1.1759297";"38.0127308"
"11";"https://www.idealista.com/inmueble/32910481/";" ""Centro. Magnifico ático reformado junto a las tendillas. 4º planta exterior con ascensor. 106 m2 distribuidos en 3 dormitorios, 1 baño y 1 aseo, cocina integrada en el salón y terraza de 12 m2. Reformado íntegramente hace pocos años, puertas de haya, suelo de gres, puerta blindada, 1 armario empotrado. La vivienda esta climatizada por split en el salón y ventiladores de techo en los dormitorios. Precio: 170.000€ 01-01-83177 inmocordoba ciudad jardín."" ";"Piso en venta en Centro, Córdoba";"170000";"106";"3";"4ª";"-4.7799362";"37.88246"
"12";"https://www.idealista.com/inmueble/32222610/";" ""REFERENCIA: MCC1294-GHPlanta baja al lado del mar.DISTRIBUCIÓN: (75 M2)- Dos habitaciones dobles una sencilla- Salón comedor can salida a terraza de mas de 50 m2- Cocina individual- Baño completo- Cuarto de lavanderíaCALIDADES:- Bajo se-mi nuevo- Suelos de gres- Carpintería interior de Madera haya vaporizada- Carpintería exterior de aluminio climalit- Calefacción gas ciudad y agua caliente- Piscina comunitaria.- Plaza de parking opcionalZONA Y TRANSPORTE PÚBLICO:El bajo esta situado al lado de Mas Mel Playa. A cien metros de la playa. Dispone de todos los servicios necesarios para vivir todo el año.Zona muy bien comunicada y cerca de la estación de Renfe de Segur de Calafell, autobuses, etc.n lugar ideal para vivir todo el año o disfrutar del tiempo libre en una de las playas más bonitas de la Costa Dorada."" ";"Piso en venta en Segur Platja, Calafell";"160000";"85";"3";"Bajo";"1.5997831";"41.1902975"
"13";"https://www.idealista.com/inmueble/30068125/";" ""Hermosa finca rústica de casi 13 Hras - siendo 6 Hras de viñedos - en el término de Sant Pere de Ribes pero lindando con el de Sitges. En ella se encuentra una masia catalana construida en el 1.600, posteriormente reformada conservando todo su encanto. La construcción principal consta de 350m2 (ampliales en 100m2 más) y está orientada al Sur. Disfruta de una hermosa vista al mar y se haya situada dentro de un valle de la misma propiedad, a 30mn andando de la playa. Existen además varias construcciones anejas."" ";" Casa o chalet independiente en venta en Vallpineda-Rocamar, Sant Pere de Ribes";"3300000";"688";"5";"Hipoteca 8.459 eur/mes - ";"1.7827687";"41.2419692"
"14";"https://www.idealista.com/inmueble/30068398/";" ""Situado en una de las principales vias de la ciudad, este piso se haya en una posición ideal, mezclando centro y naturaleza, por su proximidad a ambos entornosVivienda distribuida en 4 habitaciones mas salón, cocina y 1 baño. Exterior. A reformar. Calefacción individual a gas. Ascensor. Buen edificio. Opción de plaza de garaje grande enfrente(No incluida en el precio)."" ";"Piso en venta en paseo de Fernando el Católico, 52, Universidad San Francisco, Zaragoza";"169000";"100";"4";"2ª";"-0.8966932";"41.6395025"
"15";"https://www.idealista.com/inmueble/29605807/";" ""Vivienda en la puyade obra de 20 años de antiguedad. 75m utiles. 2 dormitorios, mas salon 28m.cocina 10.30m y baño. Una terraza en salon de 7m. Exterior e interior. Ascensor. Calefacción individual gastos de comunidad 90 euros. Armarios empotrados. Puerta blindada. Suelos de pergo. Ventanas pvc climalit oscilobatientes. Puertas de haya. Para entrar a vivir. Opciónal garaje y trastero (18.000 euros)."" ";"Piso en venta en la Puyade, San José, Zaragoza";"150000";"90";"2";"1ª";"-0.8823322";"41.6375525"
"16";"https://www.idealista.com/inmueble/30459556/";" ""Precioso piso totalmente reformado, de 70m² con 3 habitaciones ( 1 doble) y 1 baño completo. Calefacción eléctrica, parquet, aire acondicionado, puertas de Haya, ventanas aluminio, cocina equipada con barra americana, alarma, fibra óptica y puerta blindada.Dispone de una terraza a nivel de salón de 35m² para disfrutar con tus hijos este verano, incluye toldo. Es una finca antigua con solo 5 vecinos y situado en una calle muy tranquila cerca de Santa Ana, muy cerca de Renfe y autobuses.No dejes de ver este piso con sus excelentes acabados!."" ";"Piso en venta en Fontetes-La Farigola, Cerdanyola del Vallès";"179000";"70";"3";"";"2.1409286";"41.4923393"
"17";"https://www.idealista.com/inmueble/727157/";" ""Habitacion principal con baño completo y vestidor. Jardin de 45 m2, porche cubierto de 16,30 m2. Suelos de parquet, puertas haya, cocina totalmente amueblada, puerta garaje motorizada, sistema domotico con alarma incorporada. Calefacción individual de gas. La casa dispone de: cocina eléctrica vitrocerámica suelo del baño de grés ventanas de aluminio"" ";" Chalet adosado en venta en calle Valdecan Casa E s/n, Siétamo";"181000";"263";"4";"Hipoteca 464 eur/mes - ";"-0.280228";"42.1204579"
"18";"https://www.idealista.com/inmueble/2105887/";" ""Se vende ático-dúplex de 3 dormitorios en Beniajan,2 baños,cocina totalmente equipada con electrodomésticos,lavadero cerrado,amplio salón amueblado,balcón exterior,aire acondicionado y climatización en toda la casa,puerta blindada,portero automático,año construcción(2006),Orientación levante,muy luminoso,trastero de 8m2 y plaza de garaje de 34m2.3ª Planta(última).110 m2 construidos,90 m2 útiles,terraza de 25 m2 con vistas a la montaña,a Torreagüera,Monteagudo.Mi Telf.630/74/08/91 Vendo directamente a particular para que no haya intermediarios por medio. distribución: terraza descubierta de 25 m2 4 vecinos en el edificio la casa dispone de: portero automático"" ";"Dúplex en venta en carretera de San Javier, 19, Beniaján, Murcia";"163000";"100";"3";"3ª";"-1.0683075";"37.9755266"
"19";"https://www.idealista.com/inmueble/32398287/";" ""Ref. 2136 Impecable ático exterior con dos terrazas, con muy buena orientación y totalmente actualizada (7 años) una habitación doble con vestidor, cocina con vitroceramica y campana decorativa, agua caliente por acumulación, aire acondicionado en salón, suelos de parquet, interior en haya y exterior en aluminio con doble acristalamiento, baño con ducha y mampara de aluminio, comunidad reducida, calle tranquila y peatonal, próximo a estación y con buena comunicación con los servicios.¡IDEAL PARA PAREJAS!."" ";"Ático en venta en Fontetes-La Farigola, Cerdanyola del Vallès";"85000";"60";"1";"4ª";"2.1486885";"41.4930824"
"20";"https://www.idealista.com/inmueble/31711588/";" ""Piso de 3 dormitorios, amplio y luminoso totalmente reformado. Suelos de madera, carpintería interior maciza de haya y exterior de aluminio con cristal doble climalit. Aire acondicionado frío-calor con conductos. Calefacción central y agua caliente con contador individual. El precio incluye 2 plazas de garaje y un trastero."" ";"Piso en venta en tejerías, 1, Parque del Queiles, Tudela";"150000";"134";"3";"2ª";"-1.6117428";"42.0658881"
"21";"https://www.idealista.com/inmueble/34022613/";" ""PLANTA BAJA PRECIOSA EN PLENO CENTROPiso, Alquiler | España, Cataluña, Barcelona, Cornellà de Ll., CentroDescripción de la viviendaBonita planta baja en pleno centro de Cornellà cerca de La Rambla y a diez minutos caminando de SPLAU y transportes públicos.Vivienda de 78m2, tres habitaciones y 1 cuarto de baño. Dispone de ascensor en la finca. El piso posee un salón de 18m2, una cocina en buen estado con lavadero, calefacción, suelos de parquet, puertas de haya y ventanas de aluminio doble cristal. Consta con un trastero y una plaza de parking privado comunitario en la misma finca.PRECIO:Venta= 250.000 €.Comunidad= 70 € mensuales.Condiciones GeneralesDisponibilidad a acordar.La oferta se sujeta a errores, cambios de precio y/o retirada del mercado sin aviso previo. Los gastos de comunidad cuando los hubiere, serán especificados a la hora de hacer la visita por uno de nuestros comerciales.Concrete una visita con nuestros comerciales.Cornellà de Llobregat tiene una historia definida por tres factores principales: la proximidad de la ciudad de Barcelona, el hecho de ser un territorio de paso - como toda la comarca del Baix Llobregat - de las vías de entrada y salida de la capital de Catalunya, y la presencia del río Llobregat. Su nombre hace referencia a un origen romano (Cornelianus) del cual quedan vestigios, en la zona del barrio Centro entre la iglesia parroquial de Santa María y el Castell.En el año 1716 la ciudad se separó de Barcelona por el Decreto de Nueva Planta, para pasar a formar parte de la comarca del Baix Llobregat. En el año 1819 tiene lugar un cambio importante con la inauguración del Canal de la Infanta: se desarrolla el regadío y hay un extraordinario proceso de industrialización. El ferrocarril llega en el 1854. Durante un siglo el sector textil se convierte en la base económica del municipio, y a la vez, crecen los núcleos de población separados del Centro (barrios de Riera, Almeda, Pedró, la Gavarra)."" ";"Piso en venta en Centre, Cornellà de Llobregat";"250000";"78";"3";"Bajo";"2.07012";"41.3514299"
"22";"https://www.idealista.com/inmueble/32276926/";" ""Vivienda de 70m2, con una habitación doble exterior de 10m2, tres habitaciones individuales exteriores de 5,6 / 7 / 7,1m2, baño completo de 3,3m2 con plato de ducha, cocina independiente de 6,5m2, amplio comedor de 23m2, lavadero de 2m2, balcón de 5m2, garaje individual, armarios empotrados, suelos de terrazo, carpintería interior de haya y exterior de aluminio blanco, calefacción, puerta blindada, portero automático y ascensor en la finca. Con orientación Sur, exterior y muy soleado. Cerca de zonas infantiles, comercios, farmacias, transportes públicos, colegios, etc. Pregunten por nuestra financiación 100%."" ";"Piso en venta en Can Palet, Terrassa";"126000";"75";"4";"3ª";"2.0228974";"41.5509903"
"23";"https://www.idealista.com/inmueble/32624277/";" ""Como decía TINA TURNER en una de sus grandes canciones ´SIMPLY DE BEST”, SIMPLEMENTE LO MEJOR, esto es lo que les presentamos en esta ocasión, un apartamento que nos ha sorprendido positivamente, ubicado en zona tranquila, en un complejo con zona comunitaria impoluta dado al cuidado y mimo con la que trata y mantiene el conserje las instalaciones. Si lo que busca es una segunda residencia para usted y su familia seguro que este apartamento le va a gustar y mucho. DESTACAMOS: Lo principal que destacamos de este apartamento es el olor a la hora de entrar en él, huele a nuevo a limpio, un golpe de buenas vibraciones las que te ofrece este apartamento solamente al cruzar el umbral de la puerta, cuidado hasta el último detalle, Suelos de gres porcelanico, aire acondicionado con bomba de calor, tarima flotante en la terraza con césped artificial, persiana del comedor eléctrica, carpintería exterior de aluminio con doble cristal, carpintería interior de madera de haya. Esquinero a dos fachadas por lo que disfruta de mucha claridad.DISFRUTARAS DE: Salón comedor de 18 m2 con salida a terraza de 10m2, dos dormitorios dobles, cocina independiente totalmente equipada, baño completo y amplio con bañera. La vivienda se entrega completamente amueblada y con electrodomésticos, Venga a verlo, sin duda le encantará."" ";"Piso en venta en Els Pins, Blanes";"145000";"62";"2";"2ª";"2.7819603";"41.6676761"
"24";"https://www.idealista.com/inmueble/30203030/";" ""Casa unifamiliar situada a 500 metros del Club de Golf de Zapateira, disfrutando por ubicación de todos los servicios propios del casco urbano de la zona pero integrado en un entorno natural inmejorable y muy tranquilo.Dispone de una finca de 2. 000 m2 de cuidado jardín con amplia variedad de árboles y plantas, de diversas tipologías, en perfecto estado de mantenimiento. Siendo sus excelentes vistas garantizadas dada la imposibilidad de futuras construcciones en las parcelas colindantes.Realizada con materiales y acabados de primera calidad. Revestida exteriormente con piedra del país.Cabe destacar, en el contexto de los acabados y calidades, el doble acristalamiento en toda la casa, excepto en muros cortina en donde se ha colocado carpintería de primera calidad con vidrio securit exterior y triple vidrio en zonas accesibles, así como la calefacción por suelo radiante mediante colectores por plantas y termostatos individualizados por zonas y la previsión para la colocación de ascensor interior si se desea.Los 600 m2 de vivienda, distribuidos en tres plantas, dos principales conectadas por el vestíbulo de entrada, disponen de seis dormitorios, zona de estar independiente, cuatro baños y un aseo, cocina con comedor, bodega y zona de lavandería, amplio salón comedor con salida exterior y despacho biblioteca.La Planta Baja consta de un amplio salón, cuyos grandes huecos y espacios comunican la vivienda con el jardín a través de un porche en la fachada principal, con zona de comedor que comunica con la cocina así como de una zona de estar estilo biblioteca ó despacho y un dormitorio de invitados.En un nivel superior se sitúan los restantes dormitorios entre los que se haya el dormitorio principal con vestidor independiente, baño con bañera de hidromasaje y ducha doble.Así mismo dispone de una Planta Sótano con garaje para tres vehículos, trastero, cuarto de plancha y un amplio comedor informal con barbacoa y bodega independiente.La propiedad está muy bien comunicada con la ciudad de La Coruña y sus salidas, dispone de un acceso muy próximo al enlace de la tercera ronda de la Zapateira que va a comunicar directamente con el centro de la ciudad."" ";" Casa o chalet independiente en venta en Culleredo";"8e+05";"600";"6";"Hipoteca 2.050 eur/mes - ";"-8.4113516";"43.3183805"
"25";"https://www.idealista.com/inmueble/306249/";" ""ático exterior en perfecto estado de 95m mas terraza de 25m. tiene 3m de trastero, calefacción mural, puertas de haya macizas, salón de invierno de madera acristalado, chimenea, esta reformado. distribución: terraza descubierta de 25 m2."" ";"Ático en venta en avenida Catalonia, 6 7, La Salut - Lloreda, Badalona";"230000";"123";"3";"6ª";"2.2257774";"41.4479946"
"26";"https://www.idealista.com/inmueble/31908519/";" ""Cocina totalmente amueblada de diseño, piso amueblado, puertas de haya, aire centralizado en todas las habitaciones frío/calor, patio interior de 70 m2, plaza de garaje propio, baño completo con bañera dentro de la habitación principal."" ";"Piso en venta en avenida países bajos, 5 Portal, La Rinconada";"177000";"85";"3";"1ª";"-5.9831525";"37.4828435"
"27";"https://www.idealista.com/inmueble/33014878/";" ""Superf. 95 m², 3 habitaciones ( 1 suite, 2 dobles), 2 baños, cocina (OFFICE CON SALIDA A LAVADERO), lavadero, comedor (25 M2 MUY LUMINOSO), suelos PARQUET Y GRES, garaje (PLAZA AMPLIA), ascensor, calefacción, puerta blindada, portero automático, año construcción 2005, gastos comunidad 40 MESUALIDAD, agua, luz, gas, carpintería exterior ALUMINIO, carpintería interior MAZIZA HAYA VAPORIZADA, exterior, orientación ESTE O ESTE, soleado, balcón (AMPLIO CABE UNA MESA Y 4 SILLAS), Estado certificación:."" ";"Piso en venta en Balconada - Cal Gravat, Manresa";"172000";"95";"3";"4ª";"1.84064";"41.69916"
"28";"https://www.idealista.com/inmueble/32876622/";" ""Estupendo piso en venta para actualizar en la zona de patraix y tres forques, barrio consolidado con todos los servicios al alcance, desde comercios, lineas de bus, parques, colegios, ambulatorios, grandes centros comerciales. Es un barrio trabajador y familiar. La vivienda consta de 110 metros distribuidos en cuatro habitaciones (dos sencillas y dos dobles), dos cuartos de baños (uno con bañera y otro con ducha), la cocina está reformada, la vivienda es toda exterior, tiene un comedor con balcón, suelo de terrazo, ventanas de aluminio, gas natural, las puertas de haya, el zaguán está preparado para minusvalidos, tiene dos ascensores cambiados y a nivel cero. La vivienda tiene muchas posibilidades de reformas, todo exterior, es una ocasión que no puede dejar de visitar, puede que sea la vivienda que busca. este anuncio puede contener errores se muestra a titulo informativo y no contractual."" ";"Piso en venta en Vara de Quart, València";"120000";"110";"4";"1ª";"-0.4033539";"39.4645139"
