"";"URL";"Info";"Direccion";"Precio";"Superficie";"Habitaciones";"Planta";"Longitud";"Latitud"
"25";"https://www.idealista.com/inmueble/31249630/";" ""REF. 1108/482. Vendo espectacular ático, en residencial con zonas comunes, piscina, zona deportiva y zona infantil, próximo al palacio de congresos, con 2 terrazas: una de 26 metros cuadrados en la primera planta y otra de 117 metros cuadrados situada en la planta solárium. Zona de alto standing, rodeado de todos los servicios y muy bien comunicado por autobús y metro. La vivienda está distribuida en recibidor de entrada. Pasillo distribuidor con armario empotrado. Cuatro dormitorios con armarios empotrados. Dos baños completos con bañera, uno de ellos en suite principal y un aseo con ducha. Amplio y luminoso, salón comedor de 35 metros con acceso a terraza. Cocina independiente completamente equipada de muebles y zona office. Con dos plazas de garaje y un trastero incluidos en el precio. Dispone de buenas calidades, aire acondicionado frio-calor por conductos, calefacción de gas natural, suelos de parquet, puertas de haya y ventanas de aluminio."" ";"Ático en venta en Beniferri, València";"520000";"247";"4";"3ª";"-0.4044652";"39.4950688"
"26";"https://www.idealista.com/inmueble/31050481/";" ""Piso de 190 metros ubicado en Avenida Federico García Lorca, distribuido en 4 dormitorios amplios, salón -comedor de 40 metros, 2 baños, 3 terrazas, cocina amueblada de 20 metros y equipada con electrodomésticos, despensa, lavadero, dispone de varios armarios empotrados y vestidor en dormitorio principal. Aire acondicionado centralizado en toda la vivienda. Calidades de lujo, suelos de parquet, carpintería interior de madera de roble y haya. Garaje y trastero incluido en el precio. Tres ascensores, uno es montacargas. El bloque dispone de Portero y servicio de video-vigilancia. Rodeado de todos los servicios. Ideal para vivir en pleno centro de Almería. REF 022250."" ";"Piso en venta en Altamira - Oliveros - Barrio Alto, Almería";"420000";"190";"4";"6ª";"-2.4598779";"36.8371771"
"27";"https://www.idealista.com/inmueble/28493542/";" ""Bonito chalet independiente estrategicamente situado a un paso de zonas comerciales y de servicios asÃ­ como de las mejores playas de Marbella. La vivienda consta de dos plantas, situÃ¡ndose en la superior el dormitorio principal en-suite. La propiedad se haya en un pequeÃ±o complejo totalmente cerrado, lo que lo convierte en un remanso de paz y tranquilidad. El inmueble estÃ¡ completamente adaptado para uso de personas con movilidad reducida."" ";" Casa o chalet independiente en venta en Urb. Cerrado de Elviria, Comlejo las Aã©Rides, Elviria, Marbella";"580000";"175";"3";"Hipoteca 1.487 eur/mes - ";"-4.7820178";"36.4979546"
"28";"https://www.idealista.com/inmueble/31208862/";" ""Precioso piso de dos dormitorios y dos baños. A estrenar, recién rehabilitado. Proyecto de interiorismo de Maria Villalon. Cocina completamente equipada, con muebles y electrodomésticos e isla de madera de Haya. Todas las instalaciones nuevas, paredes y techos con aislamiento. Ventanales de PVC con vidrios térmicos, con cámara. Sanitarios y griferia Roca. Caldera individual Junckers a gas, para calefacción y agua caliente. Radiadores de aluminio Rayco y toalleros calefactados en baños. Termostato programador digital. Toda la iluminación a base, de led y bajo consumo. Pavimento flotante de L'Antic Colonial de Porcelanosa."" ";"Piso en venta en calle santa lucía, 16, Puerto Chico, Santander";"199000";"90";"2";"1ª";"-3.8012377";"43.4642351"
"29";"https://www.idealista.com/inmueble/29566777/";" ""Fincamps comercializa un precioso piso en el centro de Sabadell, año de construción 1965, totalmente reformado. Con una superfície habitable de 150 m2, compuesto de 4 dormitorios dobles (una suite), un baño completo y un aseo de cortesía. Dispone de un gran salón comedor con chimenea y grandes ventana en carpintería de aluminio, revestimiento del suelo en parquet y gres. Una amplia cocina office, nueva a estrenar. El piso es totalmente exterior, esquinero y muy luminoso. Se encuentra muy cerca del mercado central, rodeado de una zona comercial con diversidad de establecimientos, además todos los servicios educativos y sanitarios. CEE Y-122KW / Y-26 KG."" ";"Piso en venta en calle de torras i bages, 10, Centre, Sabadell";"350000";"150";"4";"2ª";"2.1050565";"41.545771"
"30";"https://www.idealista.com/inmueble/32725163/";" ""Piso de 3 dormitorios cercano a Carlos Haya. Mas que reforma necesita actualizar. Baño y cocinas recientemente alicatados. Segunda planta sin ascensor. Zona tranquila con buenas comunicaciones y todo tipo de servicios en las cercanías. Se informa al consumidor conforme decreto 218/2005 de la Junta de Andalucia de su derecho a la entrega de Documento Informativo Abreviado. El lugar de entrega será en nuestras oficinas. Honorarios de intermediación inmobiliaria incluidos en el precio. No se incluye gastos de notaría, gestoría y registro así como impuestos inherentes a la compra."" ";"Piso en venta en calle núñez vela, 6, La Florida - Parque norte, Málaga";"58000";"72";"3";"2ª";"-4.4513228";"36.7232476"
