"";"URL";"Info";"Direccion";"Precio";"Superficie";"Habitaciones";"Planta";"Longitud";"Latitud"
"1";"https://www.idealista.com/inmueble/25590789/";" ""Espectacular chalet de 4 años de construccion practicamente sin estrenar en la mejor zona de la peña de las aguilas, todo lujo y confort, 520 m de casa con parcela de 1. 000 m con hormigon impreso, 5 dormitorios, 3 baños, 3 vestidores grandes, sotano con bodega y salon grande bien iluminado, gimnasio y parking de 150m con puerta automatica fachada de piedra natural, grandes ventanales. Calefaccion suelo radiante por gas ciudad, aire acondicionado, gran porchada, piscina, barbacoa cerrada con cocina y baño, terrazas, varios sistemas de alarmas, techos muy altos, muy buena iluminacion todo precioso, mejor verlo al natural, las fotos no le hacen justicia construido con materiales de la mejor calidad del mercado. Precio muy por debajo de su coste de construccion. Una buena ocasion para el que quiera una vivienda de lujo al lado de elche y con parada de autobus en la puerta."" ";" Casa o chalet independiente en venta en Carrús Oest - Plaza Madrid, Elche / Elx";"850000";"600";"5";"Hipoteca 2.178 eur/mes - ";"-0.7426913";"38.2607151"
"2";"https://www.idealista.com/inmueble/33571166/";" ""Chalet en Peña de las Aguilas, con preciosa parcela ajardinada, muy cerca de Elche.La vivienda tiene 4 amplios dormitorios en la planta baja, todos con armarios empotrados, dos baños completos y cocina. Amplisimo salon con gran chimenea, con acceso al porche, donde hay unas magnificas vistas al jardin y al campo, al estar la parcela algo elevada respecto a los vecinos, muchisima luz y ventilacion.La parte de abajo de la casa esta pensada para acabarla como otra vivienda independiente, donde tenemos tres grandes dormitorios, zona de cocina de leña, un baño completo y posibilidad de hacer otro dormitorio.Tiene agua potable de aigues d'elx, agua de riego, electricidad, fin de obra, todo legal e inscrito en el registro.Esta rodeada de vecinos los cuales viven todo el año, parcela cuadrada, y de facil acceso, todo el camino asfaltado.Pozo funcional, deposito de agua.Con una reforma, sobre todo a la parte de abajo se quedaria un chalet impresionante.Negociable!."" ";" Casa o chalet independiente en venta en Carrús Oest - Plaza Madrid, Elche / Elx";"240000";"300";"7";"Hipoteca 615 eur/mes - ";"-0.7323243";"38.271828"
"3";"https://www.idealista.com/inmueble/34943783/";" ""A la venta precioso piso seminuevo en zona cortes valencianas. Con plaza de garaje en edificio y piscina comunitaria.El piso esta mejorado en obra, cuenta con un amplio salon y tres dormitorios, el principal con baño en suite.Tiene aire acondicionado instalado por conductos y armarios empotrados. Descalcificador comunitario.La vivienda es totalmente exterior, orientada al este y al sur. Las vistas son impresionantes desde toda la casa, hasta el mar, con balcon desde el salon.Muchisima luz y ventilacion, una vivienda espectacular, la mejor del edificio.Rodeada de parques y zonas verdes, con mucha vida y todo tipo de comercios, colegios, farmacias, bus. etc. bien comunicada con autovia, universidad.."" ";"Piso en venta en Carrús Oest - Plaza Madrid, Elche / Elx";"143000";"105";"3";"8ª";"-0.7193213";"38.2700049"
"4";"https://www.idealista.com/inmueble/31359729/";" ""Espectacular chalet de 340 mtr distribuido en 1 planta y semi-sotano. En la primera planta contamos con un gran salón con chimenea y split de A/A, (Todos los dormitorios cuentan con split A/A), con 3 ventanas al exterior, también tenemos una gran cocina de 16 mtr totalmente equipada y con salida a la galería, despues nos encontramos con 3 dormitorios uno de ellos con baño en suite y el baño de cortesia al final de la casa y por ultimo un cuarto de plancha. También contamos con un semi-sotano totalmente equipado con un salón de juegos con una gran mesa de billar, maquina de dardos, salón con chimenea, bar, bodega, 1 dormitorio doble, baño, gimnasio y un gran despacho. La parcela cuenta con 2. 800 mtr totalmente vallada con 2 puertas de acceso para vehiculos, gran piscina con cenador, pista de tenis y parking techado para 3 coches. El chalet esta rodeados de vecinos todo el año. Si busca vivir en un chalet con las comodidades de la ciudad esta es su casa. Venga a verla sin compromiso le gustara.REF: 5798W."" ";" Casa o chalet independiente en venta en Urb. NO, Carrús Oest - Plaza Madrid, Elche / Elx";"430000";"360";"5";"Hipoteca 1.102 eur/mes - ";"-0.7368896";"38.2606429"
"5";"https://www.idealista.com/inmueble/34316602/";" ""Buena ocasión. Vivienda de reciente construcción, con terraza en urbanizacion con piscina. Todo exterior y con estupendas vistas.La vivienda está ubicada en zona cortes valencianas, y consta de 3 dormitorios, 2 baños completos ( uno de ellos en dormitorio principal), salón comedor, cocina y amplia terraza. La vivienda está en un estado impecable y se quedaría equipada de muebles y electrodomésticosAcceso a la terraza desde salon y cocina.Preinstalacion de aire acondicionado, internet gratis en el edificio, alarma en zonas comunes.. .Zona consolidada con todos los servicios y rodado de supermercados, parques, colegios, paradas autobus.. .Muy bin comunicado.Precio 155.000 euros (incluido muebles y electrodomesticos) escuchamos ofertasSolicita visita sin compromiso, te va a gustar."" ";"Piso en venta en avenida profesor enrique tierno galván, Carrús Oest - Plaza Madrid, Elche / Elx";"155000";"105";"3";"4ª";"-0.7216726";"38.2714639"
"6";"https://www.idealista.com/inmueble/35440978/";" ""Magnifica vivienda unifamiliar en zona tranquila sobre plaza de madrid, ubicada en entorno con casas similares.Entrada directa sin comunidad. Gran salon desde el acceso principal, con un baño en la misma planta y una gran cocina-comedor, hecha de tal manera de que se pueda dividir y trasformar en una cocina independiente y un dormitorio en esta planta, la cocina y el comedor tienen salida a un patio-terraza, ideal para los niños, para relajarse con una cena intima o una divertida reunion de amigos.En la planta superior encontramos dos dormitorios juveniles con un baño compartido, y un gran dormitorio de matrimonio con un amplio vestidor y con otro baño completo en suite y un coqueto vestidor.Desde esta planta accedemos a la planta superior donde encontramos una gran terraza con posilidades para otra zona de ocio y preparada para lavadero, con agua y luz.La vivienda esta hecha a conciencia por el propietario con las mejores calidades y acabados. Aislamiento extra en medianeras con vecinos, muy silenciosa, confortable y acogedora. Ideal para vivir en una casa independiente, con amplitud y rodeada de todos los servicios.Dispone de aire acondiconado con calor instalado por conductos en toda la casa.Visitela, le gustará. Negociable!."" ";" Chalet adosado en venta en Carrús Oest - Plaza Madrid, Elche / Elx";"198000";"210";"3";"Hipoteca 507 eur/mes - ";"-0.7106524";"38.2702683"
"7";"https://www.idealista.com/inmueble/34696338/";" ""Chalet de lujo en Peña de las AguilasImpecable y amplio chalet independiente seminuevo, ubicado en exclusivo residencial privado cerrado de alto standing.La vivienda se divide en dos plantas mas semisotano.El salon es muy amplio y cuenta con chimenea, frente al mismo tenemos una gran cocina terminada en un bonito chaflan redodondo, con acceso a un patio lavadero. Tenemos 5 grandes dormitorios con armarios empotrados, dormitorio principal con baño en suite y vestidor a medida, 3 baños completos. Aire acondicionado por conductos y radiadores de gas natural, Alarma, bañera de hidromasaje.Amplisimo Sotano ventilado con chimenea, con baño completo, despensa, cuarto de herramientas y bodega.En el exterior tiene un ampliio porche techado y dos terrazas, la parcela esta muy ajardinada, preparada con riego por goteo y plantas tropicales. Cochera para dos coches, puerta automatica, gran barbacoa de obra, con horno de leña, baño completo y almacen para herramientas. Pozo Algibe.Gran piscina privada en funcionamiento, muy soleada, instalacion en perfecto estado.Es suelo urbano, casa totalmente legalizada, agua, electricidad y gas. Esta a escasos metros del nuevo hospital, farmacia, centro comercial, tienda y restaurantes, pegada a la ciudad, zona muy tranquila, pero con acceso a la autovia, a 14 kilometros de la playa y a 8 del aeropuerto. Parada de bus urbano a unos metros.Un sueño hecho realidad, un chalet impresionante en urbanizacion privada, la tranquilidad e intimidad del campo al lado de la ciudad. Concebido para disfrutar, lo mejor para su familia.Concierte su visita con nosotros, no le decepcionará."" ";" Casa o chalet independiente en venta en Carrús Oest - Plaza Madrid, Elche / Elx";"490000";"400";"5";"Hipoteca 1.255 eur/mes - ";"-0.7283192";"38.2628114"
"8";"https://www.idealista.com/inmueble/32885026/";" ""PISO EN VENTA EN ELCHEPiso con 100m2 a lado de la Avenida Libertad con Ascensor. TOTALMENTE Amueblado con 2 aparatos de aire acondicionado. y preinstalación de música en toda la casa. La Vivienda tiene 3 habitaciones, 2 baños y un salón grande de 25m2. Tiene Balcón y una galería con lavadora, secadora y espacio para tender la ropa. MUY LUMINOSO CON TODO EXTERIOR!  Además cerca del centro, Corte Inglés, Aljub y los accesos a la autovía.UNA OPORTUNIDAD QUE NO DEBES PERDER."" ";"Piso en venta en Calle Jesus Chazarra, 12, Carrús Oest - Plaza Madrid, Elche / Elx";"93000";"100";"3";"4ª";"-0.7126523";"38.2656268"
"9";"https://www.idealista.com/inmueble/33342361/";" ""Magnífica vivienda de orientación mediodía situada en la planta séptima de un edificio, ubicado al pié de la avenida de Novelda. Esta estupenda vivienda con más de 130 metros cuadrados de superficie, cuenta con un gran salón independiente de 22 metros cuadrados más una terraza cuadrada de ocho con unas buenas vistas a la ciudad, cocina office de 25 metros cuadrados más galería de tres, tres amplios dormitorios con posibilidades de formar cuatro, cuarto de baño y dos trasteros dentro de la vivienda. La vivienda ha sido reformada parcialmente, teniendo la capintería exterior de aluminio climalit, puertas de roble, baños reformados totalmente y cocina en excelente estado de uso.La propiedad, está situada en una de las zonas más consolidadas del toscar, ya que queda al pié de las líneas de bus que llevan a todas las zonas de la ciudad y está rodeada de todo tipo de establecimientos y servicios.Una oportunidad de comprar un chollo de vivienda."" ";"Ático en venta en Carrús Oest - Plaza Madrid, Elche / Elx";"95000";"138";"3";"7ª";"-0.7105608";"38.2717329"
"10";"https://www.idealista.com/inmueble/35933298/";" ""Se vende vivienda muy luminosa, chaflán con todas sus piezas al exterior, no tiene prácticamente pasillo. Situada en una zona comercial ideal para poder pasear o realizar cualquier compra que pueda necesitar. A pocos metros de un instituto. Solo un vecino por planta."" ";"Piso en venta en Carrús Oest - Plaza Madrid, Elche / Elx";"83000";"105";"3";"5ª";"-0.708907";"38.2703933"
"11";"https://www.idealista.com/inmueble/35817596/";" ""Vivienda en primera planta sin ascensor, 3 amplios dormitorios, cocina totalmente reformada con galería acristalada, baño reformado con luz y ventilación natural con ducha amamparada y mueble de baño moderno, salón de 18m2, la vivienda está recientemente reformada, ventanas de aluminio climalit, electricidad y fontanería saneada, puertas lisas modernas de haya, cocina de módulos modernos con lavavajillas, puerta blindada, balcón con toldos, trastero en terraza. Vivienda para entrar a vivir, edificio con zonas comunes restauradas y muy bien ubicado cercano a todos los servicios. VEN A VERLA! REF. 7025P."" ";"Piso en venta en Carrús Oest - Plaza Madrid, Elche / Elx";"60000";"85";"3";"2ª";"-0.7159601";"38.2707097"
"12";"https://www.idealista.com/inmueble/34937432/";" ""fantastico duplex en zona avenida de libertad rodeado de todos los servicios primera planta salon, recividor muy amplio, cocina y aseo segunda planta habitaciones y baño en suit, tarima en toda la vivienda casa totalmente amueblad con cocina equipada plaza de garaje para dos coches y trastero de unos 6 metros cuadrados."" ";"Dúplex en venta en calle Josep Bernad Amorós s/n, Carrús Oest - Plaza Madrid, Elche / Elx";"135000";"120";"3";"3ª";"-0.7108947";"38.2679461"
"13";"https://www.idealista.com/inmueble/27213358/";" ""Exclusivo, con mucha luz exterior y ventilación. Se entrega amueblado y con electrodomésticos.Ubicado en ""Zona Boulevard"", el mejor punto de la Avenidade Novelda. Todo tipo de comercios, establecimientos, bancos, colegios, paradas de bus, de taxis, de tren.. . A 10 minutos a pie del centro. Tiene balcón, galería y gran armario empotrado en la habitación de matrimonio. Es un 5º con ascensor. Tiene rampa en la entrada de la finca. Dos vecinos por planta. Comunidad muy tranquila. Sin intermediarios. Absternerse interesados sin capacidad real de compra. Gracias."" ";"Piso en venta en calle Av de Novelda, 45, Carrús Oest - Plaza Madrid, Elche / Elx";"133000";"160";"4";"5ª";"-0.7106158";"38.2720522"
"14";"https://www.idealista.com/inmueble/33700474/";" ""Chalet de lujo en la Partida Peña Aguilas, a 3 minutos del caso urbano de Elche. Multiples servicios, autobuses, zona comercial. Vivienda de 750 metros cuadrados, amplia cocina y salon, pista de tenis, barbacoa, gimnasia y varias plazas de parking, aire acondicionado, calefaccion, chimeneas. Zona palazón."" ";" Casa o chalet independiente en venta en partida peña águilas, 275, Carrús Oest - Plaza Madrid, Elche / Elx";"399000";"750";"6";"Hipoteca 1.022 eur/mes - ";"-0.7324446";"38.2705079"
"15";"https://www.idealista.com/inmueble/35571573/";" ""Obra nueva en Elche, calle Jaime Agueda Torregrosa nº 23.Viviendas de 3 dormitorios, 2 baños, salón comedor, cocina y galeria, y en el precio se incluye una plaza de aparcamiento.Hay viviendas en planta baja con entrada independiente, y hay otras que son los terceros que tienen una terraza privativa de unos 65 metros cuadrados."" ";"Piso en venta en calle Jaime Agueda Torregrosa, 23, Carrús Oest - Plaza Madrid, Elche / Elx";"130000";"70";"3";"Bajo";"-0.7155869";"38.2743626"
"16";"https://www.idealista.com/inmueble/35571602/";" ""Obra nueva en Elche, calle Jaime Agueda Torregrosa nº 23.Viviendas de 3 dormitorios, 2 baños, salón comedor, cocina y galeria, y en el precio se incluye una plaza de aparcamiento.Hay viviendas en planta baja con entrada independiente, y hay otras que son los terceros que tienen una terraza privativa de unos 65 metros cuadrados."" ";"Piso en venta en calle Jaime Agueda Torregrosa, 23, Carrús Oest - Plaza Madrid, Elche / Elx";"130000";"87";"3";"1ª";"-0.7155869";"38.2743626"
"17";"https://www.idealista.com/inmueble/35571606/";" ""Obra nueva en Elche, calle Jaime Agueda Torregrosa nº 23.Viviendas de 3 dormitorios, 2 baños, salón comedor, cocina y galeria, y en el precio se incluye una plaza de aparcamiento.Hay viviendas en planta baja con entrada independiente, y hay otras que son los terceros que tienen una terraza privativa de unos 65 metros cuadrados."" ";"Piso en venta en calle Jaime Agueda Torregrosa, 23, Carrús Oest - Plaza Madrid, Elche / Elx";"130000";"87";"3";"2ª";"-0.7155869";"38.2743626"
"18";"https://www.idealista.com/inmueble/35571607/";" ""Obra nueva en Elche, calle Jaime Agueda Torregrosa nº 23.Viviendas de 3 dormitorios, 2 baños, salón comedor, cocina y galeria, y en el precio se incluye una plaza de aparcamiento.Hay viviendas en planta baja con entrada independiente, y hay otras que son los terceros que tienen una terraza privativa de unos 65 metros cuadrados."" ";"Piso en venta en calle Jaime Agueda Torregrosa, 23, Carrús Oest - Plaza Madrid, Elche / Elx";"120000";"90";"3";"2ª";"-0.7155869";"38.2743626"
"19";"https://www.idealista.com/inmueble/35571608/";" ""Obra nueva en Elche, calle Jaime Agueda Torregrosa nº 23.Viviendas de 3 dormitorios, 2 baños, salón comedor, cocina y galeria, y en el precio se incluye una plaza de aparcamiento.Hay viviendas en planta baja con entrada independiente, y hay otras que son los terceros que tienen una terraza privativa de unos 65 metros cuadrados."" ";"Piso en venta en calle Jaime Agueda Torregrosa, 23, Carrús Oest - Plaza Madrid, Elche / Elx";"115000";"95";"3";"2ª";"-0.7155869";"38.2743626"
"20";"https://www.idealista.com/inmueble/35571609/";" ""Obra nueva en Elche, calle Jaime Agueda Torregrosa nº 23.Viviendas de 3 dormitorios, 2 baños, salón comedor, cocina y galeria, y en el precio se incluye una plaza de aparcamiento.Hay viviendas en planta baja con entrada independiente, y hay otras que son los terceros que tienen una terraza privativa de unos 65 metros cuadrados."" ";"Piso en venta en calle Jaime Agueda Torregrosa, 23, Carrús Oest - Plaza Madrid, Elche / Elx";"125000";"92";"3";"2ª";"-0.7155869";"38.2743626"
"21";"https://www.idealista.com/inmueble/35571611/";" ""Obra nueva en Elche, calle Jaime Agueda Torregrosa nº 23.Viviendas de 3 dormitorios, 2 baños, salón comedor, cocina y galeria, y en el precio se incluye una plaza de aparcamiento.Hay viviendas en planta baja con entrada independiente, y hay otras que son los terceros que tienen una terraza privativa de unos 65 metros cuadrados."" ";"Piso en venta en calle Jaime Agueda Torregrosa, 23, Carrús Oest - Plaza Madrid, Elche / Elx";"140000";"87";"3";"3ª";"-0.7155869";"38.2743626"
"22";"https://www.idealista.com/inmueble/35571612/";" ""Obra nueva en Elche, calle Jaime Agueda Torregrosa nº 23.Viviendas de 3 dormitorios, 2 baños, salón comedor, cocina y galeria, y en el precio se incluye una plaza de aparcamiento.Hay viviendas en planta baja con entrada independiente, y hay otras que son los terceros que tienen una terraza privativa de unos 65 metros cuadrados."" ";"Piso en venta en calle Jaime Agueda Torregrosa, 23, Carrús Oest - Plaza Madrid, Elche / Elx";"130000";"90";"3";"3ª";"-0.7155869";"38.2743626"
"23";"https://www.idealista.com/inmueble/35571613/";" ""Obra nueva en Elche, calle Jaime Agueda Torregrosa nº 23.Viviendas de 3 dormitorios, 2 baños, salón comedor, cocina y galeria, y en el precio se incluye una plaza de aparcamiento.Hay viviendas en planta baja con entrada independiente, y hay otras que son los terceros que tienen una terraza privativa de unos 65 metros cuadrados."" ";"Piso en venta en calle Jaime Agueda Torregrosa, 23, Carrús Oest - Plaza Madrid, Elche / Elx";"125000";"95";"3";"3ª";"-0.7155869";"38.2743626"
"24";"https://www.idealista.com/inmueble/35571614/";" ""Obra nueva en Elche, calle Jaime Agueda Torregrosa nº 23.Viviendas de 3 dormitorios, 2 baños, salón comedor, cocina y galeria, y en el precio se incluye una plaza de aparcamiento.Hay viviendas en planta baja con entrada independiente, y hay otras que son los terceros que tienen una terraza privativa de unos 65 metros cuadrados."" ";"Piso en venta en calle Jaime Agueda Torregrosa, 23, Carrús Oest - Plaza Madrid, Elche / Elx";"135000";"92";"3";"3ª";"-0.7155869";"38.2743626"
"25";"https://www.idealista.com/inmueble/35767507/";" ""Se vende chalet muy acogedor en peña de las águilas, pol. I, dentro de una parcela de 2800 m2, y con una construcción de 450 m2, distribuidos en dos plantas habitadas y un semisótano diáfano, para hacer a su gusto. La vivienda dispone en la planta principal de una amplia zona de día, con cocina comedor, salón con chimenea, habitación doble y aseo/baño. En la primera planta se encuentran las 4 habitaciones abuhardilladas, y dos baños, uno en suite en reforma actualmente. Desde la habitación de matrimonio se accede a una hermosa terraza con estupendas y despejadas vistas. Vivienda muy agradable y cómoda para vivir todo el año, rodeada de vecinos, parada de bus urbano y a 5 minutos del centro ciudad. Un lujo y una calidad de vida! ref. 1831s."" ";" Casa o chalet independiente en venta en Carrús Oest - Plaza Madrid, Elche / Elx";"226000";"450";"5";"Hipoteca 579 eur/mes - ";"-0.7459776";"38.2741116"
"26";"https://www.idealista.com/inmueble/35990542/";" ""Se vende vivienda en 2º planta cerca de la Avenida de Novelda en Elche. Tiene 115 m² repartidos en 3 dormitorios, 1 baño, amplia cocina independiente, salón y balcón. La vivienda está de origen. Posibilidad de financiación hasta el 100%."" ";"Piso en venta en calle leopoldo vicente serrano, 13, Carrús Oest - Plaza Madrid, Elche / Elx";"77500";"115";"3";"2ª";"-0.7153914";"38.2755747"
"27";"https://www.idealista.com/inmueble/33366870/";" ""magnifica vivienda sitiada en la avd libertad, muy bien comunicada, cerca de colegios, centros comerciales, hospital. La vivienda cuenta con una superficie útil de 88 metros cuadrados, la vivienda es toda exterior, tiene mucha luz natural, cuenta con 3 habitaciones, 2 baños completos, cocina recientemente cambiada y una galería. Las habitaciones son todas muy luminosas, cuenta con aparato de aire acondicionado. Los baños tienen uno de ellos plato de ducha y el otro bañera."" ";"Piso en venta en Carrús Oest - Plaza Madrid, Elche / Elx";"87500";"92";"3";"5ª";"-0.7152006";"38.2669236"
"28";"https://www.idealista.com/inmueble/31753252/";" ""Ocasión Única en Elche (Alicante)Piso / Elche / Alicante / Planta Baja / 81 metros cuadradosPiso localizado en Elche, perteneciente a la provincia de Alicante. El inmueble se encuentra en la calle Emilio Sala Hernandez, Planta Baja. Dispone de 81 metros cuadrados construidos (63 metros cuadrados útiles). Cuenta con tres habitaciones y un baño. Disponibilidad completa para mostrar el inmueble durante cualquier día de la semana, contando adicionalmente con propuestas de financiación en el caso de que pudiera interesar. No dude en contactarnos para poder informarle con más detalle sobre las características del inmueble. Referencia del Inmueble: 2012_0231_PE0231."" ";"Piso en venta en calle emilio sala hernandez, 45, Carrús Oest - Plaza Madrid, Elche / Elx";"35900";"81";"3";"";"-0.7161248";"38.2714183"
"29";"https://www.idealista.com/inmueble/36014078/";" ""Se vende vivienda en 2º planta cerca de la avenida de novelda en elche. Tiene 115 m² repartidos en 3 dormitorios, 1 baño, amplia cocina independiente, salón y balcón. La vivienda está de origen. Posibilidad de financiación hasta el 100%."" ";"Piso en venta en calle leopoldo vicente serrano, Carrús Oest - Plaza Madrid, Elche / Elx";"77500";"95";"3";"";"-0.7142914";"38.2735747"
"30";"https://www.idealista.com/inmueble/33147672/";" ""Vivienda unifamiliar desarrollada por el prestigioso estudio de arquitectura “fuster arquitectos” donde la luz invade cada uno de los rincones de la misma gracias a sus amplísimos ventanales y sus cuatro orientaciones. Cuenta con espacios diferenciados y perfectamente conectados entre sí con doble altura en la estancia principal, desde la que se accede a la cocina, varios servicios higiénicos y dependencias en planta baja. Al subir por su escalera de diseño, encontraremos la planta donde se ubican las dependencias destinadas a descanso de la familia e invitados con diferentes servicios higiénicos en suite y de servicio, así como vestidor en la habitación principal, y las terrazas-solárium y miradores de la vivienda dese donde se puede divisar toda la trayectoria del sol desde que nace hasta que anochece, por su perfecta orientación hacia el sur (medio día). En la planta sótano, que cuenta con patio para ventilación e iluminación natural, encontramos diferentes dependencias, destinadas a despacho, gimnasio, sala de cine, salón de juegos lavandería y servicios higiénicos. Se completa la vivienda con la parcela que incluye jardín, parcela con césped natural y piscina propia, además, junto a la villa, se encuentra una zona infantil de uso exclusivo de los vecinos de la zona. Los acabados de la vivienda son de auténtico lujo: carpintería exterior con rotura de puente térmico abatible y oscilo-batiente con vidrios de alto aislamiento e insonorización, carpintería interior lacada blanca, con puertas correderas ocultas en cocina y puertas de madera noble de zebrano en planta superior. Los solados son de porcelánico rectificado de gran formato y los cerámicos de diseños de tendencia. La vivienda se encuentra perfectamente ubicada a escasos metros del centro comercial l´aljub y el centro comercial carrefour elche, con acceso inmediato a la autovía a7 y a la nacional n340. Si busca una vivienda de diseño exclusivo y alto standing, esta es su vivienda."" ";" Casa o chalet independiente en venta en Carrús Oest - Plaza Madrid, Elche / Elx";"1016000";"600";"7";"Hipoteca 2.604 eur/mes - ";"-0.726662";"38.2593403"
