"";"URL";"Info";"Direccion";"Precio";"Superficie";"Habitaciones";"Planta";"Longitud";"Latitud"
"27";"https://www.idealista.com/inmueble/31423434/";" ""Superf. 170 m², útil 74 m², 4 habitaciones (2 dobles, 2 individuales), 1 baño, 1 aseo, alumbrado, asfaltado, urbanizado, cocina (butano/ con salida a terraz), comedor (salida a terraza), terraza, suelos gress, jardín (barbacoa y huerto), garaje, armarios, calefacción, muebles, puerta blindada, vidrios dobles, agua (butano), luz, gas, chimenea, carpintería exterior aluminio, carpintería interior haya, orientación sur, soleado, piscina, teléfono, Estado certificación A 20 km de las playas de LLORET DE MAR (COSTA BRAVA)."" ";" Casa o chalet independiente en venta en Urb. RESIDENCIAL PARC, Maçanet de la Selva";"150000";"170";"4";"Hipoteca 384 eur/mes - ";"2.7052886";"41.7873838"
"28";"https://www.idealista.com/inmueble/1990387/";" ""Inmejorable relación calidad/precio. Particular, sin intermediarios, en urbanización de lujo. Superficie de 58 m², 1 habitación de matrimonio doble amueblada, 1 baño, cocina independiente amueblada y dotada de electrodomésticos, comedor amueblado, suelos de gres, jardín comunitario, plaza de garaje exterior, ascensor, armario empotrado revestido con cajonera, altillo y barra para colgar, instalación de calefacción y aire acondicionado de la marca daikin con bomba de calor, portero automático, doble acristalamiento, puerta de entrada acorazada, mosquiteros en todas las ventanas, año construcción: 2006, carpintería exterior de aluminio, carpintería interior de madera en haya vaporizada, todas las habitaciones son exteriores con vistas al mar, orientación sur, piscinas comunitarias(3), incluyendo una calefactada por energía solar con 7 zonas de relax dotadas de chorros de impulsión de aire y utilizada habitualmente para nadar, otra enorme en el centro de la urbanización y con más de 1900 m2 de superficie y otra infantil para los más pequeños, zonas solarium en las piscinas, terraza cubierta (13 m2), 8 pistas de pádel, amplias zonas verdes y con pasillos para pasear (entre 3 y 4 hectáreas de superficie), zona de juegos para niños y campos de petanca y fútbol, campo de minigolf, zona social con terraza, segunda línea de playa. El complejo se encuentra en la Ensenada de San Miguel con una extensa y tranquila playa."" ";"Piso en venta en calle Mascarón, 1, Almerimar, El Ejido";"130000";"58";"1";"1ª";"-2.7827739";"36.6918905"
"29";"https://www.idealista.com/inmueble/2085752/";" ""ático de 53 m2,junto al Club Nautico del Puerto de Roquetas,con preciosas vistas al mar y al Puerto Deportivo.A pocos metros de la playa.Totalmente amueblado y equipado.Suelo de parquet en madera de jatoba.Terraza descubierta de 44m² alrededor de toda la vivienda,con entarimado de madera,ideal para tomar el sol a cualquier hora del día.Salón de 18m2 muy luminoso.Cocina independiente,luminosa con ventana a la terraza,con pasa platos y suelo en gres porcelánico,alicatado de cocina en cerámica de 1ª calidad.Cuarto de baño con suelo y paredes de mármol Macael,lavamanos de acero cromado sobre encimera de vidrio y ducha con mampara,con tarima imitacion madera.1 dormitorio doble de 15 m2,amplio y luminoso,con armario empotrado y acceso directo a la terraza.La vivienda cuenta con carpinteria de aluminio lacado en color,doble acristalamiento termoacústico tipo ?climalit?,griferia de diseño monomando cromada en baños y cocinas.Puertas de paso en madera de haya.Puerta de entrada blindada con cerradura de seguridad.Videoportero,toma de teléfono y antena tv en dormitorio y estar.Antena parabólica.Preinstalación de hilo musical y aire acondicionado.Año de construcción 2006.Al ser segunda residencia,este ático está prácticamente nuevo y muy bien cuidado,pues tampoco ha sido alquilado.Lo vendemos por residir en otro lugar y apenas hacemos uso de la vivienda por falta de tiempo por motivos laborales y personales. distribución: terraza descubierta de 44 m2 3 vecinos en el edificio la casa dispone de: portero automático"" ";"Ático en venta en calle Escalerilla, 2, El Puerto - La Romanilla, Roquetas de Mar";"135000";"53";"1";"4ª";"-2.6065091";"36.7565962"
"30";"https://www.idealista.com/inmueble/1605910/";" ""Ático en calle Arte Expresionista, 24, 65 metros de vivienda, garaje y trastero incluidos en el precio. La finca dispone de gimnasio equipado y piscina, vigilancia 24 horas. El edificio tiene actualmente vigente un contrato de alquiler de 750 euros mensuales. Hipoteca con un capital pendiente de amortización de 100000 euros apróx. que bien puede ser cancelada o, en su caso, objeto de subrogación.Precio no negociable."" ";"Ático en venta en paseo Pau de Vallecas, 2, Madrid";"225000";"65";"1";"8ª";"-3.6264932";"40.3685771"
"31";"https://www.idealista.com/inmueble/32000609/";" ""Piso distribuido salón, cocina con despensa, 3 habitaciones, 1 baño, terraza y trastero. Ubicado en una zona consolidada, a escasos metros del Ayuntamiento y de la Plaza de la Constitución."" ";"Piso en venta en calle madrid, Humanes de Madrid";"99000";"94";"3";"4ª";"-3.83086";"40.2501499"
